Number,Sentence,Template,Keywords,A_F1_Lists,AV_F1_Lists,Slope,Offset,Naturalness,Discomfort,Responses,Audio_screening_F1,Linguistics_screening_F1,Video_screening_F1,Audio_screening_F2,Linguistics_screening_F2,Video_screening_F2,Audio_screening_M1,Linguistics_screening_M1,Video_screening_M1,Audio_screening_M2,Linguistics_screening_M2,Video_screening_M2
698,Han accepterer nok at vi fremskynder festen,8,"accepterer, fremskynder, festen",0,0,9.407370859,-0.615612184,5.63,0,8,1,1,1,1,1,1,1,1,0,1,1,1
699,Det er selve kongen som roser jeres generation,9,"kongen, roser, generation",0,0,12.21196945,-2.619971729,4.8,0,10,1,1,1,1,1,1,1,1,0,1,1,1
700,Han havde imponeret os med sit talent og sin fantasi,10,"imponeret, talent, fantasi",0,0,162.9989502,2.613681631,6.8,0,10,1,1,1,1,1,1,1,1,0,1,0,1
701,Der er et kapitel der virkelig skræmmer læserne,1,"kapitel, skræmmer, læserne",0,0,9.638214067,-0.208593321,5.67,0,9,1,1,1,1,1,1,1,1,1,1,1,1
702,Jeg er tit for optimistisk når jeg planlægger min ferie,2,"optimistisk, planlægger, ferie",0,0,242.327725,2.593777679,6.33,0,9,1,0,1,1,1,1,1,1,1,1,1,1
703,Spillerne burde koncentrere sig mere om forsvaret,3,"spillerne, koncentrere, forsvaret",0,0,16.09495978,0.867691712,6.56,0,9,1,1,1,1,1,1,1,1,0,1,1,1
704,Han tænkte over hvordan træer egentlig kan vokse,4,"tænkte, træer, vokse",0,0,16.17951841,0.042227208,6.25,0,8,1,1,1,1,1,1,1,1,0,1,1,1
705,Det er nødvendigt at vi sparer på vores energi,5,"nødvendigt, sparer, energi",0,0,8.894691488,-1.090748584,6.56,0,9,1,1,1,1,1,1,1,1,1,1,1,1
706,Til februar vil alle måske stemme på vores kandidat,6,"februar, stemme, kandidat",0,0,10.82053828,1.873542691,5.44,0,9,1,1,1,1,1,1,1,1,1,1,0,0
707,Hun har anbefalet den her bank til sin egen far,7,"anbefalet, bank, far",0,0,12.52563577,0.446536822,6,0,9,1,1,1,1,1,1,1,1,1,1,1,1
708,De havde ofte sagt at man burde styrke politiet,8,"sagt, styrke, politiet",0,0,7.182789296,-0.401257999,6.11,0,9,1,1,1,1,1,1,1,1,1,1,1,1
709,Det var bare en hest som tyggede på noget græs,9,"hest, tyggede, græs",0,0,47.2088819,-1.810696163,6.63,0,8,1,1,1,1,1,1,1,1,1,1,1,1
710,Den her kasse ligner et fjernsyn eller en computer,10,"kasse, fjernsyn, computer",0,0,15.2013576,0.58871764,6,0,9,1,1,1,1,0,1,1,1,0,1,0,1
711,Der var en pressechef der forenklede beskeden,1,"pressechef, forenklede, beskeden",0,0,30.67542804,-1.508552881,6.13,0,8,1,1,1,1,1,1,1,1,1,1,1,0
712,Hun var virkelig sød selvom hun fremstod lidt barsk,2,"sød, fremstod, barsk",0,0,8.11754997,0.799920341,6.44,0,9,1,1,1,1,1,1,1,1,1,1,1,1
713,Man kan lige netop ane flyet omme bag ved hallen,3,"ane, flyet, hallen",0,0,14.24637469,-4.063747643,5.44,1,9,1,1,1,1,1,0,1,1,0,1,1,1
714,Hun forklarede os hvordan man kan finansiere et lån,4,"forklarede, finansiere, lån",0,0,5.597609907,-1.275816392,6.78,0,9,1,1,1,1,1,1,1,1,1,1,1,1
715,Det var smart at de strammede op på deres adfærd,5,"smart, strammede, adfærd",0,0,18.21905396,1.849365673,5.44,1,9,1,1,1,1,1,1,1,1,1,1,0,1
716,På mandag udkommer min allerførste artikel,6,"mandag, udkommer, artikel",0,0,89.79366833,-0.502148211,6.89,0,9,1,1,1,1,1,1,1,0,1,1,1,1
717,Han har doneret sit tøj til en eller anden organisation,7,"doneret, tøj, organisation",0,0,13.39206126,2.727046035,6.56,1,9,1,1,1,1,1,1,1,1,1,1,0,1
718,Jeg mener faktisk at vi kan forebygge flere skader,8,"mener, forebygge, skader",0,0,12.75587173,0.671087887,6.78,0,9,1,1,1,1,1,1,1,1,1,1,1,1
719,Det er direktørens strategi som ikke fungerer,9,"direktørens, strategi, fungerer",0,0,12.15651364,0.245869093,5.6,0,10,1,1,1,1,1,1,1,0,1,1,1,1
720,De har fanget hovedpersonen og hans partner,10,"fanget, hovedpersonen, partner",0,0,14.76688856,0.675801071,5.33,0,9,1,1,1,1,1,1,1,1,1,1,1,1
721,Der er en mand der vil offentliggøre hele historien,1,"mand, offentliggøre, historien",0,0,23.15071057,0.35862804,5.4,0,10,1,1,1,1,1,1,1,1,0,1,1,0
722,Hun er usikker når hun skal synge foran mange folk,2,"usikker, synge, folk",0,0,31.86784887,0.721776156,6.3,1,10,1,1,1,1,1,1,1,1,1,1,1,1
723,Han hævede stemningen med sine kommentarer,3,"hævede, stemningen, kommentarer",0,0,9.020324212,-0.059995787,5.13,0,8,1,1,1,1,1,1,1,1,1,1,1,1
724,De har forklaret hvorfor vi skal løfte forbuddet,4,"forklaret, løfte, forbuddet",0,0,5.329339098,-0.545441953,5.9,0,10,1,1,1,1,1,1,1,1,1,1,1,1
725,Det er usædvanligt at han skruer så højt op for lyden,5,"usædvanligt, skruer, lyden",0,0,9.620997362,0.494464109,6.6,1,10,1,1,1,0,1,1,1,1,0,1,0,1
726,Inden på torsdag skal vi helst have spist alt kødet,6,"torsdag, spist, kødet",0,0,11.19698769,0.589013142,6.1,0,10,1,1,1,1,1,1,1,1,1,1,1,1
727,Jeg afleverede simpelthen varerne til en cafe,7,"afleverede, varerne, cafe",0,0,7.545438298,-1.882031284,5.5,0,10,1,1,1,1,1,1,1,1,1,1,1,1
728,Han påstod at vi ville overtage hans supermarked,8,"påstod, overtage, supermarked",0,0,10.96021087,1.441108488,5.3,0,10,1,1,0,1,1,1,1,1,0,1,0,1
729,Det var præsidenten selv som havde udsat mødet,9,"præsidenten, udsat, mødet",0,0,14.24012864,0.933297562,5.6,0,10,1,1,1,1,1,1,1,1,0,1,1,1
730,Kineserne vil sikkert snart lette lidt på presset,10,"kineserne, lette, presset",0,0,20.70787937,-1.627128046,5.9,1,10,1,1,1,1,1,1,1,1,1,1,1,1
731,Der var en turist der hoppede op på en lastbil,1,"turist, hoppede, lastbil",0,0,11.52315383,-1.220738676,5.9,1,10,1,1,1,1,1,1,1,1,1,1,1,1
732,Han var munter fordi vi fornyede hans abonnement,2,"munter, fornyede, abonnement",0,0,9.465667418,-1.216863504,6.13,0,8,1,1,1,1,1,1,1,1,0,1,1,1
733,De ville gerne smage på kagen inden bryllupet,3,"smage, kagen, bryllupet",0,0,13.03569169,0.196323433,6.6,0,10,1,1,1,1,1,1,1,1,1,1,1,1
734,Jeg mærkede hvordan hele båden vippede,4,"mærkede, båden, vippede",0,0,16.60423153,-2.348807426,6.6,0,10,1,1,1,1,1,1,1,1,1,1,0,1
735,Det var fornuftigt at han forholdt sig til eksemplet,5,"fornuftigt, forholdt, eksemplet",0,0,10.33436742,-0.412191047,6.13,0,8,1,1,1,1,1,1,1,1,0,1,1,1
736,Efter scoringen udskiftede de faktisk målmanden,6,"scoringen, udskiftede, målmanden",0,0,10.53875961,1.223487948,6.38,0,8,1,1,1,1,1,1,1,1,1,1,1,1
737,Vores advokat har tilføjet et afsnit til anbefalingen,7,"advokat, tilføjet, anbefalingen",0,0,7.899472304,2.691332954,5.88,0,8,1,1,1,1,1,0,1,1,1,1,0,1
738,Vi tænkte at du ville kunne vurdere det her tilbud,8,"tænkte, vurdere, tilbud",0,0,7.930697236,-0.60035385,6.1,0,10,1,0,1,1,1,1,1,1,0,1,1,1
739,Det er en kritiker som har oversat anmeldelsen,9,"kritiker, oversat, anmeldelsen",0,0,15.30422672,0.087690445,5.2,0,10,1,1,1,1,1,1,1,1,1,1,0,1
740,Bygningen havde hverken varmt vand eller strøm,10,"bygningen, vand, strøm",0,0,24.74032125,0.930190515,6.7,1,10,1,1,1,1,1,1,1,1,1,1,0,1
741,Der er mange begivenheder der kan ændre markedet,1,"begivenheder, ændre, markedet",0,0,20.40171149,-1.9469534,5.78,0,9,1,1,1,1,1,0,1,1,0,1,1,1
742,De er rige fordi de prioriterer deres økonomi,2,"rige, prioriterer, økonomi",0,0,18.9314995,-1.705355385,5.5,1,10,1,1,1,1,1,1,1,1,1,1,1,1
743,De har ansat mange pædagoger her i kommunen,3,"ansat, pædagoger, kommunen",0,0,20.42219808,1.128152549,6.56,1,9,1,1,1,1,1,1,1,1,0,1,1,1
744,Han iagttog hvordan vi anvendte vores metode,4,"iagttog, anvendte, metode",0,0,11.58256265,0.786944349,6,0,9,1,1,0,1,1,1,1,1,1,1,1,1
745,Det er klart at vi sagtens kan måle hastigheden,5,"klart, måle, hastigheden",0,0,8.618371227,-1.951838663,6.25,0,8,1,1,1,1,0,1,1,1,1,1,1,1
746,I november fastansatte de faktisk en historiker,6,"november, fastansatte, historiker",0,0,4.519301439,1.008431206,5.88,0,8,1,1,1,1,1,1,1,0,1,1,1,1
747,Min arbejdsgiver har sendt mig nogle blomster,7,"arbejdsgiver, sendt, blomster",0,0,14.42633756,-2.061614217,6.44,1,9,1,1,1,1,1,1,1,1,1,1,1,1
748,Hun mener at vi forholder os realistisk til statistikken,8,"mener, forholder, statistikken",0,0,22.42916073,3.152717493,6.63,0,8,1,1,1,1,1,1,0,1,1,1,1,1
749,Det var en biolog som betragtede insekterne,9,"biolog, betragtede, insekterne",0,0,13.9378366,-1.866085452,6.38,0,8,1,1,1,1,1,1,1,1,1,1,1,0
750,Hun red vist hen over broen og ind i skoven,10,"red, broen, skoven",0,0,239.2711348,-2.08423752,5.9,0,10,1,1,1,1,1,1,1,1,1,1,1,1
751,Der var en reol der bare trængte til lidt maling,1,"reol, trængte, maling",0,0,15.47094697,-0.722060995,5.63,0,8,1,1,1,1,1,0,1,1,1,1,1,1
752,Han var helt frisk selvom han havde fløjet i et døgn,2,"frisk, fløjet, døgn",0,0,25.67066262,1.159064537,5.4,0,10,1,1,1,1,1,1,1,1,0,1,1,1
753,Deres angribere har bragt dem helt til finalen,3,"angribere, bragt, finalen",0,0,9.711029875,-0.119485472,6.33,0,9,1,1,1,1,1,1,1,1,1,1,0,1
754,Han havde opfanget hvad der var foregået på værelset,4,"opfanget, foregået, værelset",0,0,13.54081998,-0.252519036,5.9,0,10,1,1,0,1,1,1,1,1,1,1,1,1
755,Det var dejligt at I lokkede os med på rejsen,5,"dejligt, lokkede, rejsen",0,0,30.89703526,-0.605346572,6.11,0,9,1,1,1,1,1,1,1,1,1,1,0,1
756,Ifølge analysen kan vi godt afskaffe nogle af reglerne,6,"analysen, afskaffe, reglerne",0,0,11.41292236,-0.03812668,6,1,9,1,1,1,1,1,1,1,1,1,1,1,1
757,Cheftræneren har inviteret os til forhandlinger,7,"cheftræneren, inviteret, forhandlinger",0,0,10.72980299,1.985771616,6.5,0,8,1,1,1,1,1,1,1,1,1,1,0,1
758,Hun har bevist at organisationen faktisk eksisterer,8,"bevist, organisationen, eksisterer",0,0,20.90026666,2.752800615,5.8,0,10,1,1,1,1,1,1,1,1,1,1,0,1
759,Det er politikerne som repræsenterer befolkningen,9,"politikerne, repræsenterer, befolkningen",0,0,28.25660815,2.613533823,6.56,2,9,1,1,1,1,1,1,1,1,1,1,1,1
760,Producenten har allerede lovet os en forklaring,10,"producenten, lovet, forklaring",0,0,21.50748698,0.006120544,6.67,0,9,0,1,1,1,1,1,1,1,0,1,1,1
761,Der er en hel del der cykler til deres arbejdsplads,1,"del, cykler, arbejdsplads",0,0,24.1900182,3.433085548,6.11,1,9,1,0,1,1,1,1,1,1,0,1,1,1
762,Jeg er glad for at jeg er startet på en uddannelse,2,"glad, startet, uddannelse",0,0,7.419370439,6.362486864,6.78,0,9,1,1,1,1,1,1,1,1,1,1,0,1
763,Man kan heldigvis søge et tilskud til transporten,3,"søge, tilskud, transporten",0,0,10.57753519,1.488280849,6.44,0,9,1,1,1,1,1,1,1,1,1,1,1,1
764,De har fortalt os hvad der skabte al balladen,4,"fortalt, skabte, balladen",0,0,13.73649053,2.273175183,5.89,0,9,1,1,1,1,1,1,1,1,1,1,1,1
765,Det er kedeligt at vi stadig kæmper med et underskud,5,"kedeligt, kæmper, underskud",0,0,13.8979116,-0.897049377,6.33,1,9,1,1,1,1,1,0,1,1,1,1,1,1
766,I januar skal vi måske organisere to afstemninger,6,"januar, organisere, afstemninger",0,0,7.840398818,0.219571902,6.33,0,9,1,1,1,1,1,1,1,1,1,1,1,1
767,Vi kan sagtens holde fiskeri uden for diskussionen,7,"holde, fiskeri, diskussionen",0,0,14.57974235,0.656091693,5.25,0,8,1,1,1,1,1,1,1,1,1,1,1,1
768,Det betyder at I snart skal stoppe med undervisningen,8,"betyder, stoppe, undervisningen",0,0,22.58490307,4.126357937,6.78,0,9,1,1,1,1,1,1,1,1,1,1,1,1
769,Det var min bror som havde glemt min fødselsdag,9,"bror, glemt, fødselsdag",0,0,35.16503098,1.880576763,6.22,1,9,1,1,1,1,1,1,1,1,1,1,1,1
770,Hun kan både håndtere ansvaret og udfordringerne,10,"håndtere, ansvaret, udfordringerne",0,0,16.91293481,-0.209103194,6.56,0,9,1,1,1,1,1,1,1,1,1,1,1,1
771,Der var en elefant der kiggede venligt på min hustru,1,"elefant, kiggede, hustru",0,0,17.00878487,-0.724220495,3.25,0,8,1,1,1,1,1,1,1,1,0,1,0,1
772,Hun var meget rig fordi hun havde investeret i olie,2,"rig, investeret, olie",0,0,14.32980186,-1.053661938,5.56,0,9,1,1,1,1,1,1,1,1,1,1,1,1
773,En eller anden har placeret et kamera på mit kontor,3,"placeret, kamera, kontor",0,0,32.39671195,-1.085017788,6.22,1,9,1,1,1,1,1,1,1,1,1,1,0,1
774,Han respekterede hvordan vi plejede at gøre,4,"respekterede, plejede, gøre",0,0,10.2790169,-0.581694231,5.5,0,10,1,1,1,1,1,1,1,1,1,1,1,1
775,Det var fantastisk at de bare godkendte vores udspil,5,"fantastisk, godkendte, udspil",0,0,8.002632952,1.960760879,5.67,0,9,1,1,1,1,1,1,1,1,1,1,0,1
776,Efter kaffen kan vi lige sammenligne vores lister,6,"kaffen, sammenligne, lister",0,0,16.33895931,-1.87964252,5.89,1,9,1,1,1,1,1,1,1,1,1,1,1,1
777,Jeg efterlod desværre noget vin hos ministeren,7,"efterlod, vin, ministeren",0,0,8.382838163,-1.137490076,4.78,1,9,1,1,1,1,1,1,1,1,1,1,1,1
778,Det gælder jo om at vi bevarer alle vores fordele,8,"gælder, bevarer, fordele",0,0,16.41725026,-1.340783958,5.89,1,9,1,1,1,1,1,1,1,1,1,1,1,1
779,Det er nemlig en myte som stammer fra medierne,9,"myte, stammer, medierne",0,0,25.03409048,-2.624989645,5.67,1,9,1,1,1,1,1,1,1,0,1,1,1,1
780,Han værdsatte virkelig både kemi og matematik,10,"værdsatte, kemi, matematik",0,0,20.07500766,-0.621560892,5.38,0,8,1,1,1,1,1,1,1,1,1,1,0,0
781,Der er to af episoderne der foregår på et sygehus,1,"episoderne, foregår, sygehus",0,0,19.04349201,-0.246651645,5.89,0,9,1,1,1,1,1,0,1,1,0,1,1,1
782,Han er fair når han konkurrerer med sine kammerater,2,"fair, konkurrerer, kammerater",0,0,19.00377973,-0.183183011,5.89,1,9,1,1,1,1,0,1,1,1,1,1,0,1
783,Vi vil rigtigt gerne bruge jeres video i en udsendelse,3,"bruge, video, udsendelse",0,0,12.74491368,-0.341622908,6.22,0,9,1,0,1,1,1,1,1,1,1,1,1,1
784,Jeg kan forestille mig hvordan de reagerede på brevet,4,"forestille, reagerede, brevet",0,0,9.524187159,-1.91011959,6,0,9,1,1,1,1,1,1,1,1,1,1,1,0
785,Det er fornuftigt at de endelig dropper det lovforslag,5,"fornuftigt, dropper, lovforslag",0,0,17.98510045,-1.131483467,6.2,0,10,1,1,1,1,1,0,1,0,1,1,0,1
786,Tilbage i marts strammede vi op på vores økonomi,6,"marts, strammede, økonomi",0,0,11.37658841,-1.096712772,5.67,0,9,1,1,1,1,1,1,1,1,1,1,1,1
787,Hun har igen købt en masse ting til vores afdeling,7,"købt, ting, afdeling",0,0,46.6179934,2.091784065,6,1,9,1,1,1,1,1,1,1,1,1,1,1,1
788,De legede at de kunne flyve rundt ligesom ænder,8,"legede, flyve, ænder",0,0,9.29997691,-0.926530322,5,0,9,1,1,1,1,1,1,1,1,1,1,0,1
789,Det var en prins som ville investere i vores restaurant,9,"prins, investere, restaurant",0,0,35.80865523,0.370838803,5.11,0,9,1,1,1,1,1,1,1,1,1,1,1,1
790,Hun forsker stadig i kultur og bæredygtig mode,10,"forsker, kultur, mode",0,0,9.122272182,-1.628680422,6,0,10,1,1,1,1,1,1,1,1,1,1,1,1
791,Der var nogle kvinder der dannede en forening,1,"kvinder, dannede, forening",0,0,19.00176017,-1.765726867,6.33,1,9,1,1,1,1,1,1,1,1,1,1,1,0
792,Det var smukt fordi vi havde pyntet op i lokalet,2,"smukt, pyntet, lokalet",0,0,17.13835552,2.029237418,6.75,0,8,1,1,1,1,1,1,1,1,1,1,1,1
793,Min far prøvede selvfølgelig på at tænde for skærmen,3,"far, tænde, skærmen",0,0,38.85777196,4.14117601,5.78,0,9,1,1,1,1,1,1,1,1,1,1,0,1
794,De har annonceret hvem der går videre til finalen,4,"annonceret, går, finalen",0,0,24.58919648,0.350177626,5.89,0,9,1,1,1,1,1,1,1,1,0,1,1,1
795,Det var ret klogt at vi bad dem om en kontrakt,5,"klogt, bad, kontrakt",0,0,11.11088099,1.159492839,6.11,0,9,1,1,1,1,0,0,1,1,0,1,0,1
796,Til foråret vil de faktisk anlægge endnu en motorvej,6,"foråret, anlægge, motorvej",0,0,11.87641628,-2.524888422,5.67,1,9,1,1,1,1,1,1,1,1,1,1,1,1
797,Min arbejdsgiver har lige tilbudt mig en formue,7,"arbejdsgiver, tilbudt, formue",0,0,14.69814201,-0.542280708,4.8,0,10,1,1,1,1,1,1,1,1,1,1,1,1
798,Det forekommer mig at vi burde styrke budgettet,8,"forekommer, styrke, budgettet",0,0,14.59061857,0.529003836,5.33,0,9,1,1,1,1,1,0,1,1,0,1,0,1
799,Det er et princip som gælder i alle samfund,9,"princip, gælder, samfund",0,0,26.30359297,1.625190571,5.67,0,9,1,1,1,1,1,1,1,1,0,1,1,1
800,Hun skulle servere for både komponisten og musikerne,10,"servere, komponisten, musikerne",0,0,9.607993445,-2.164796196,5.78,1,9,1,1,1,1,1,1,1,1,1,1,0,1
801,Der er mange unge der uddanner sig inden for IT,1,"unge, uddanner, IT",0,0,25.57989143,-0.209713385,6.88,0,8,1,1,1,1,1,1,1,1,1,1,1,1
802,Hun er intens når hun diskuterer med de studerende,2,"intens, diskuterer, studerende",0,0,11.44629203,2.101467842,6,0,8,1,1,1,1,1,1,1,1,1,1,1,1
803,Ambassadøren fremviste gerne hele paladset selv,3,"ambassadøren, fremviste, paladset",0,0,31.84349857,2.108430251,5.75,0,8,1,1,1,1,0,1,1,1,1,1,1,1
804,Vi administrerer selv hvem der må låne bøgerne,4,"administrerer, låne, bøgerne",0,0,10.02816002,-4.226605808,6.22,0,9,1,1,1,1,1,1,1,1,1,1,1,1
805,Det var lidt uventet at hun opnåede sådan en succes,5,"uventet, opnåede, succes",0,0,14.34359433,-1.800322272,6.13,0,8,1,1,1,1,1,1,1,1,0,1,0,1
806,Efter nytår afholder vi igen koncerter og skuespil,6,"nytår, afholder, skuespil",0,0,8.079009519,2.296047384,6.88,0,8,1,1,1,1,1,1,1,1,1,1,0,0
807,Sælgeren havde fristet os med en attraktiv pris,7,"sælgeren, fristet, pris",0,0,20.94568151,-0.275626664,6,0,8,1,1,1,1,1,1,1,1,1,1,1,1
808,Han konstaterede at vi allerede havde pakket tv'et ud,8,"konstaterede, pakket, tv'et",0,0,11.12355291,-0.099274628,6.13,0,8,1,1,1,0,1,1,1,1,0,1,1,1
809,Det var en melding som bekræftede mit synspunkt,9,"melding, bekræftede, synspunkt",0,0,21.99280398,0.646324392,6.38,0,8,1,1,1,1,1,1,1,1,1,1,1,1
810,Hun havde vækket sin chauffør og alle gæsterne,10,"vækket, chauffør, gæsterne",0,0,23.06276297,0.597842922,5.25,0,8,1,1,1,1,1,1,1,1,1,1,1,1
811,Der var bare en gren der var faldet ned fra et træ,1,"gren, faldet, træ",0,0,26.49594214,1.62129995,5.75,0,8,1,1,1,0,1,1,1,1,0,1,1,0
812,De var optimistiske fordi de kunne tyde symbolerne,2,"optimistiske, tyde, symbolerne",0,0,22.58055632,-1.803892284,5.88,0,8,1,1,1,1,1,1,1,1,1,1,1,1
813,Alle på mit kontor interesserer sig meget for landsholdet,3,"kontor, interesserer, landsholdet",0,0,15.07721076,0.070889087,6.22,0,9,1,1,1,0,1,1,1,1,0,1,1,1
814,Hun har beregnet hvor meget vi kan spare på hotellet,4,"beregnet, spare, hotellet",0,0,14.24466846,0.767356206,6.38,0,8,1,1,1,1,1,1,1,1,0,1,1,1
815,Det er perfekt at vi kan trække hele beløbet fra,5,"perfekt, trække, beløbet",0,0,12.83625283,3.129513348,6.25,0,8,1,1,1,1,1,1,1,1,0,1,1,1
816,På bare én formiddag svækkede de hele sektoren,6,"formiddag, svækkede, sektoren",0,0,9.996215933,-1.048629788,5.63,1,8,1,1,1,1,1,1,1,1,1,1,1,1
817,Konsulenten opdaterede mig om situationen,7,"konsulenten, opdaterede, situationen",0,0,19.87919789,2.970805254,6.25,0,8,1,1,1,1,1,1,1,1,1,1,1,1
818,Jeg har antydet at han egentlig burde udstille sine figurer,8,"antydet, udstille, figurer",0,0,10.9480826,-0.601199902,5,0,8,1,1,1,1,1,1,1,1,1,1,1,1
819,Det er musikerne som selv startede diskussionen,9,"musikerne, startede, diskussionen",0,0,17.74876718,1.202515831,4.75,0,8,1,1,1,1,1,1,1,1,0,1,1,1
820,Hun ville helst læse noget med design eller kultur,10,"læse, design, kultur",0,0,11.29080471,0.018804383,6.38,0,8,1,1,1,1,1,1,1,1,0,1,0,1
821,Der er meget lidt værktøj der forsvinder fra vores lager,1,"værktøj, forsvinder, lager",0,0,29.74545093,0.123524411,5.13,0,8,1,1,0,1,1,1,1,1,0,1,1,1
822,Han er usædvanlig hvis han lader dig prøve igen,2,"usædvanlig, lader, prøve",0,0,8.362758558,-4.126112873,3.5,0,8,1,1,1,1,1,1,1,1,1,1,1,0
823,De fleste personer satte sig ned under reklamerne,3,"personer, satte, reklamerne",0,0,26.28751252,0.539111015,5.67,0,9,1,1,1,1,1,1,1,1,0,1,1,0
824,Jeg vidste godt hvorfor de tilkaldte en fotograf,4,"vidste, tilkaldte, fotograf",0,0,16.73790373,0.850238815,5.75,0,8,1,1,1,1,1,0,1,1,1,1,1,0
825,Det var udmærket at han tilføjede et kapitel mere,5,"udmærket, tilføjede, kapitel",0,0,21.00067359,-0.825026385,5.75,0,8,1,1,1,0,0,1,1,1,0,1,0,1
826,Inden jul skal vi nok have installeret de her lys,6,"jul, installeret, lys",0,0,15.53589725,-2.093691959,6.5,0,8,1,1,1,1,1,1,1,1,1,1,1,1
827,De har allerede udbetalt fem millioner til investorerne,7,"udbetalt, millioner, investorerne",0,0,229.6958397,0.284853988,6.75,0,8,1,1,1,1,1,1,1,1,1,1,0,1
828,Hun forventer faktisk at nogen citerer hendes digte,8,"forventer, citerer, digte",0,0,11.01631808,-1.140620522,5.75,0,8,1,1,1,1,1,1,1,1,1,1,1,1
829,Det var mest de unge som benyttede hjemmesiden,9,"unge, benyttede, hjemmesiden",0,0,23.53668349,-4.089870035,7,0,8,1,0,1,1,1,1,1,1,0,1,1,1
830,Han hilste både på værten og på premierministeren,10,"hilste, værten, premierministeren",0,0,16.96946972,-0.264635084,6.63,0,8,1,1,1,1,1,1,1,1,1,1,0,1
831,Der var nogle værksteder der lokkede med tilbud,1,"værksteder, lokkede, tilbud",0,0,16.10880413,-1.161101916,5.5,0,8,1,1,1,1,1,1,1,1,1,1,1,1
832,Hun var stolt fordi hun også havde ydet et bidrag,2,"stolt, ydet, bidrag",0,0,7.803378299,-1.961776362,6.5,0,8,1,0,1,1,1,1,1,1,1,1,1,1
833,En af ingeniørerne har lige justeret maskinerne,3,"ingeniørerne, justeret, maskinerne",0,0,14.21928011,0.023279157,6.63,0,8,1,1,1,1,1,1,1,1,1,1,1,1
834,Vi drøftede hvordan vi bedst kunne opfylde vores mål,4,"drøftede, opfylde, mål",0,0,11.06025659,0.348465576,6.88,0,8,1,1,1,1,1,1,1,1,1,1,1,1
835,Det er ret vigtigt at vi bevarer alle de lokale museer,5,"vigtigt, bevarer, museer",0,0,19.10942074,-1.123176718,6.13,0,8,1,1,1,1,1,1,1,1,1,1,1,0
836,Næste år vil han lede efter en anden arbejdsplads,6,"år, lede, arbejdsplads",0,0,29.23469336,1.741573458,6.5,0,8,1,1,1,1,1,1,1,1,1,1,0,1
837,Vi kan selvfølgelig bare tage toget ind til centrum,7,"tage, toget, centrum",0,0,51.43047245,0.762282057,7,0,8,1,1,1,1,1,1,1,1,1,1,1,1
838,Jeg vurderede at jeg godt kunne klare oplægget selv,8,"vurderede, klare, oplægget",0,0,23.44578819,-1.084880877,6.88,0,8,1,1,1,1,1,1,1,1,1,1,1,1
839,Det er en ung dreng som vil udfordre favoritten,9,"dreng, udfordre, favoritten",0,0,8.561983467,-3.301458386,5,0,8,1,1,1,1,1,1,1,1,1,1,1,1
840,Han har oplevet stor opbakning gennem sin karriere,10,"oplevet, opbakning, karriere",0,0,13.97550458,0.453372863,6.63,0,8,1,1,1,1,1,1,1,1,1,1,0,1
841,Der er mange telefoner der indeholder et kamera,1,"telefoner, indeholder, kamera",0,0,22.37118367,0.821806953,6.5,0,10,1,1,1,1,1,1,1,1,1,1,1,1
842,Han er først parat når han har klædt om efter showet,2,"parat, klædt, showet",0,0,11.38397676,1.78408526,6,0,10,1,1,1,1,1,1,1,1,1,1,1,1
843,Justitsministeren skar igennem under valgkampen,3,"justitsministeren, skar, valgkampen",0,0,14.06770419,0.928471573,6.4,0,10,1,1,1,1,1,1,1,0,1,1,1,1
844,Hun overvejede hvem der kunne arrangere en udstilling,4,"overvejede, arrangere, udstilling",0,0,6.72217467,0.288461088,6.2,0,10,1,1,1,1,1,1,1,1,1,1,1,0
845,Det var nødvendigt at de byggede et sygehus,5,"nødvendigt, byggede, sygehus",0,0,14.41696574,-1.587772862,6.3,0,10,1,1,1,1,1,0,1,1,0,1,1,1
846,I august skal hun allerede til at begynde i børnehave,6,"august, begynde, børnehave",0,0,12.62335905,-0.240173485,5.1,1,10,1,1,1,1,1,1,1,1,1,1,1,1
847,Vi skulle engang levere nogle planter til en højskole,7,"levere, planter, højskole",0,0,47.4327931,0.523177978,6.6,0,10,1,1,0,1,1,1,1,1,1,1,1,1
848,Jeg kan huske at jeg udleverede tre computere,8,"huske, udleverede, computere",0,0,10.53152543,1.289210989,6.5,0,10,1,1,1,1,1,1,1,1,1,1,1,1
849,Det var folketinget som modsatte sig flere besparelser,9,"folketinget, modsatte, besparelser",0,0,6.146396573,3.493796504,5.8,0,10,1,1,1,1,1,1,1,1,1,1,1,1
850,Generalsekretæren ville hilse på mig og min partner,10,"generalsekretæren, hilse, partner",0,0,8.109140008,-2.454529653,5.7,0,10,1,1,0,1,1,1,1,1,1,1,1,1
851,Der var desværre en rytter der væltede i tredje runde,1,"rytter, væltede, runde",0,0,12.35810261,-4.190793826,6.5,0,10,1,1,1,1,1,1,1,1,1,1,1,1
852,De var ærlige da de omtalte vores samarbejde,2,"ærlige, omtalte, samarbejde",0,0,13.41932428,0.153859995,6.5,0,10,0,1,1,1,1,1,1,1,1,1,1,1
853,Udtalelserne står stadigvæk på jeres hjemmeside,3,"udtalelserne, står, hjemmeside",0,0,18.70719592,1.169758093,5.7,0,10,1,1,1,1,1,1,1,1,0,1,1,1
854,Vi vil fokusere på hvordan vi kan bidrage til byggeriet,4,"fokusere, bidrage, byggeriet",0,0,9.714216759,0.206499538,6.2,0,10,1,1,1,1,1,1,1,1,0,1,1,1
855,Det er meget underligt at brevet aldrig dukkede op,5,"underligt, brevet, dukkede",0,0,9.891239887,-0.469642537,6.7,0,10,1,1,1,1,1,1,1,1,1,1,1,1
856,Inden oktober skal vi have gennemgået beviserne,6,"oktober, gennemgået, beviserne",0,0,30.08350052,-2.025585528,6.3,0,10,1,1,1,1,1,1,1,1,1,1,1,1
857,Man kan nok kalde deres beslutning for urimelig,7,"kalde, beslutning, urimelig",0,0,23.4192395,0.0740177,5.7,0,10,1,1,1,1,0,1,1,1,1,1,0,1
858,Hun vurderer at hun kan flette endnu flere hjerter,8,"vurderer, flette, hjerter",0,0,6.775548716,-2.478511467,6,0,8,1,1,1,1,1,1,1,1,0,1,1,1
859,Det er en af forhandlerne som afsendte ordren,9,"forhandlerne, afsendte, ordren",0,0,4.300404773,-10.11357309,6.13,0,8,1,1,1,1,1,1,1,1,1,1,1,1
860,Han ville gerne inddrage staten i overenskomsten,10,"inddrage, staten, overenskomsten",0,0,20.23877174,3.034095866,5.4,0,10,1,1,1,1,1,1,1,1,1,1,0,1
861,Der er flere overskrifter der lyder ret morsomme,1,"overskrifter, lyder, morsomme",0,0,14.37865272,0.217081437,6.22,0,9,1,1,1,1,1,1,1,1,1,1,1,1
862,Vi er effektive selvom vores udstyr ikke fungerer,2,"effektive, udstyr, fungerer",0,0,29.52085408,0.74201391,6,0,9,1,1,1,1,1,1,1,1,1,1,0,1
863,Regnen vil senere brede sig ud over hele landet,3,"regnen, brede, landet",0,0,9.778358299,-1.999121806,6.44,0,9,1,1,1,1,1,1,1,1,1,1,1,1
864,Han betragtede hvordan vi pakkede figurerne ind,4,"betragtede, pakkede, figurerne",0,0,13.45145633,0.191216267,6.13,0,8,1,1,1,1,0,1,1,1,1,1,1,1
865,Det var spændende at vi skulle besøge ministeriet,5,"spændende, besøge, ministeriet",0,0,7.672369038,1.667604666,6.22,1,9,1,1,1,1,1,0,1,1,0,1,1,1
866,I den her uge skal hun forberede sig til mesterskabet,6,"uge, forberede, mesterskabet",0,0,6.925100745,2.294890073,6.22,0,9,1,1,1,1,1,1,1,1,1,1,1,1
867,Jeg præsenterede formanden for en af investorerne,7,"præsenterede, formanden, investorerne",0,0,9.87652898,1.26580596,6.22,0,9,1,1,1,1,1,1,1,1,0,1,1,1
868,Det betød at vi sagtens kunne tilfredsstille vælgerne,8,"betød, tilfredsstille, vælgerne",0,0,7.21572889,2.378462034,6.56,0,9,1,1,1,1,1,1,1,0,1,1,0,1
869,Det var jeres avis som først kommenterede videoen,9,"avis, kommenterede, videoen",0,0,20.01177972,-2.883171124,6,0,10,1,1,1,1,1,1,1,1,1,1,1,1
