Number,Sentence,Template,Keywords,A_F1_Lists,AV_F1_Lists,Slope,Offset,Naturalness,Discomfort,Responses,Audio_screening_F1,Linguistics_screening_F1,Video_screening_F1,Audio_screening_F2,Linguistics_screening_F2,Video_screening_F2,Audio_screening_M1,Linguistics_screening_M1,Video_screening_M1,Audio_screening_M2,Linguistics_screening_M2,Video_screening_M2
524,De beslutter hvornår vi skal forstærke murene,4,"beslutter, forstærke, murene",0,0,11.4138021,-0.770845211,5.21,1,14,1,1,1,1,1,1,1,1,1,1,1,1
525,Det er glimrende at I har gemt alle billederne,5,"glimrende, gemt, billederne",0,0,14.59997233,-2.566009556,6.07,0,14,1,1,1,1,1,1,1,1,1,1,1,1
526,I februar kan vi igen opjustere vores forbrug,6,"februar, opjustere, forbrug",0,0,5.972690902,-0.903997803,5.75,0,8,1,1,1,1,1,1,1,1,0,1,1,1
527,Hun havde faktisk fået meget støtte fra folketinget,7,"fået, støtte, folketinget",0,0,30.08353765,1.73905853,5.79,0,14,1,1,1,1,1,0,1,1,1,1,1,1
528,Han kræver at vi påtager os hele ansvaret,8,"kræver, påtager, ansvaret",0,0,20.46143817,1.587832835,6.21,0,14,1,1,1,1,1,1,1,1,1,1,1,1
529,Det er jeres kartofler som forbrugerne foretrækker,9,"kartofler, forbrugerne, foretrækker",0,0,14.35974078,-1.751728865,5.53,0,15,1,1,0,1,1,1,1,1,1,1,1,1
530,Vi betragter egentlig deres udspil som en advarsel,10,"betragter, udspil, advarsel",0,0,10.93351278,-0.283267182,5.71,1,14,1,1,1,1,1,0,1,1,1,1,1,1
531,Der er en nyhed der snart rammer overskrifterne,1,"nyhed, rammer, overskrifterne",0,0,18.2612761,-1.566963523,5.07,0,14,1,1,1,1,1,0,0,1,1,1,1,0
532,Han var ret vred da han smed os ud af sin stue,2,"vred, smed, stue",0,0,19.11944246,0.275567903,6.64,1,14,1,1,1,1,1,1,1,1,1,1,0,1
533,De anerkendte altid jeres evner i parlamentet,3,"anerkendte, evner, parlamentet",0,0,10.63438726,1.040593519,5.29,0,14,1,1,1,1,1,1,1,1,1,1,1,0
534,Det afhænger af hvordan man tyder drømmen,4,"afhænger, tyder, drømmen",0,0,9.402822628,-2.258484653,6.14,0,14,1,1,1,1,1,1,1,1,1,1,1,1
535,Det var vidunderligt at hun havde født en pige,5,"vidunderligt, født, pige",0,0,16.60451564,-1.74961322,6.75,0,8,1,1,1,1,1,1,1,1,0,1,1,1
536,I vores kommune skal vi afvikle en konference,6,"kommune, afvikle, konference",0,0,13.05835032,-2.578545001,5.57,0,14,1,1,1,1,0,1,1,1,1,1,1,1
537,Ambassadøren kan sagtens skaffe dig en tilladelse,7,"ambassadøren, skaffe, tilladelse",0,0,33.46105744,3.407388434,6.29,1,14,1,1,1,1,1,1,1,1,1,1,1,1
538,Hun erklærede at hun ville leve med konsekvenserne,8,"erklærede, leve, konsekvenserne",0,0,12.0241167,-1.655601051,5.43,0,14,1,1,0,1,1,1,1,0,1,1,1,1
539,Det var en assistent som havde smurt fadene,9,"assistent, smurt, fadene",0,0,12.84397731,-0.718874809,5.25,0,8,1,1,1,1,1,1,1,1,0,1,1,1
540,Hovedpersonen drejede sig hurtigt og flygtede,10,"hovedpersonen, drejede, flygtede",0,0,13.48635861,1.250397394,5.36,0,14,1,1,1,1,1,1,1,1,1,1,1,1
541,Der var få elever der forbedrede deres gennemsnit,1,"elever, forbedrede, gennemsnit",0,0,22.79066295,0.13666435,5.94,0,16,1,1,1,1,1,1,1,1,0,1,1,1
542,Hun er omhyggelig når hun skal veje pakkerne,2,"omhyggelig, veje, pakkerne",0,0,8.175646764,-3.775831255,6.33,0,15,1,1,0,1,1,1,1,1,0,1,1,1
543,Journalisterne havde udtænkt mange spørgsmål,3,"journalisterne, udtænkt, spørgsmål",0,0,13.78410085,-0.206217424,6.38,0,8,1,1,1,1,1,1,1,1,1,1,1,1
544,Vi har oplevet hvordan de præsterer på banen,4,"oplevet, præsterer, banen",0,0,10.01568479,-1.733652438,6.25,0,8,0,1,1,1,1,1,1,1,1,1,1,1
545,Det er problematisk at I benytter vores udgang,5,"problematisk, benytter, udgang",0,0,22.53384209,0.108558297,6.13,0,16,1,1,1,1,0,1,1,1,0,1,1,1
546,I efteråret kan vi igen koncentrere os om driften,6,"efteråret, koncentrere, driften",0,0,11.41393314,0.612433257,5.29,0,14,1,1,1,1,1,1,1,1,1,1,1,1
547,Hun ville gerne give digterne en masse penge,7,"give, digterne, penge",0,0,11.36654086,-0.926696452,5.57,0,14,1,1,1,1,1,1,1,0,1,1,1,1
548,De regnede med at vi ville ankomme før premieren,8,"regnede, ankomme, premieren",0,0,12.71187407,-0.962580674,5.86,0,14,1,1,1,0,1,1,1,0,1,1,1,1
549,Det er hendes mand som ringede til en rådgiver,9,"mand, ringede, rådgiver",0,0,9.453925936,0.538632034,3.13,0,15,1,1,1,1,1,1,1,1,1,1,1,1
550,Vi vil alle gerne fremme dialog og forståelse,10,"fremme, dialog, forståelse",0,0,14.54809601,0.412112225,5.93,0,15,1,1,1,1,1,0,1,1,1,1,0,1
551,Der er mange danskere der glæder sig over fremgangen,1,"danskere, glæder, fremgangen",0,0,11.5500761,2.423703382,6.27,0,15,1,1,1,1,1,1,1,1,1,1,1,1
552,Han var nervøs fordi han havde skuffet sine fans,2,"nervøs, skuffet, fans",0,0,15.1564608,1.588256498,6,0,16,1,1,1,1,1,1,1,1,0,1,1,1
553,Vi søgte længe efter oplysningerne på biblioteket,3,"søgte, oplysningerne, biblioteket",0,0,12.22701735,0.693402326,6.53,0,15,1,1,1,1,1,1,1,1,1,1,0,1
554,Ledelsen bestemmer hvor meget vi må løfte,4,"ledelsen, bestemmer, løfte",0,0,24.06412918,0.925159125,5,0,15,1,1,1,1,1,1,1,1,1,1,1,1
555,Det var positivt at de havde overstået prøverne,5,"positivt, overstået, prøverne",0,0,9.009387701,0.065593955,5.93,0,14,1,1,0,1,1,1,1,1,0,1,1,1
556,I folkeskolen er der sket meget siden reformen,6,"folkeskolen, sket, reformen",0,0,11.50506971,1.544808359,6.14,0,14,1,1,1,1,1,1,1,1,0,1,1,1
557,Bestyrelsen har faktisk indstillet hende til en pris,7,"bestyrelsen, indstillet, pris",0,0,14.6959818,1.238136254,5.73,1,15,0,1,1,1,1,1,1,1,1,1,1,1
558,Jeg mærkede straks at hesten ville overleve,8,"mærkede, hesten, overleve",0,0,6.885938404,-2.644161319,4.93,0,15,1,1,0,1,1,1,1,1,1,1,0,1
559,Det var en analytiker som havde anmeldt koncernen,9,"analytiker, anmeldt, koncernen",0,0,33.20945751,-1.181812405,5.57,1,14,1,1,1,1,1,1,1,1,1,1,1,1
560,Man kan altid låne en telefon på vores skole,10,"låne, telefon, skole",0,0,21.35374317,0.573764929,6.27,0,15,1,0,1,1,1,1,1,0,1,1,1,1
561,Der var flere ændringer der skulle forebygge uheld,1,"ændringer, forebygge, uheld",0,0,8.827410895,-1.28771446,5.44,0,16,1,1,1,1,1,1,1,1,1,1,1,1
562,De er søde selvom vi igen har skubbet betalingen,2,"søde, skubbet, betalingen",0,0,13.05199054,-1.545027295,4.75,1,16,1,1,1,0,1,1,1,1,1,1,0,1
563,Hun traf selve generalsekretæren i en biograf,3,"traf, generalsekretæren, biograf",0,0,3.325205479,-1.016096679,4.81,1,16,1,1,1,1,1,1,1,1,1,1,0,1
564,De har skrevet hvor længe nummeret vil vare,4,"skrevet, nummeret, vare",0,0,15.98699585,-0.261023661,5.44,0,16,1,1,1,1,1,1,1,1,0,1,1,1
565,Det er ret skønt at sådan en farve kan opstå,5,"skønt, farve, opstå",0,0,17.33367183,0.20794335,4.75,0,8,1,1,1,1,0,1,1,1,1,1,1,1
566,Ifølge planen burde vi have tjent fire milliarder,6,"planen, tjent, milliarder",0,0,16.31171842,-0.662030556,6.69,0,16,1,1,1,1,1,1,1,1,1,1,0,1
567,En eller anden stjerne bad mig om noget kaffe,7,"stjerne, bad, kaffe",0,0,14.64786452,-0.033033239,4.5,0,16,1,1,1,1,1,1,1,1,1,1,1,1
568,Vi har før oplevet at de gemmer deres fjernsyn,8,"oplevet, gemmer, fjernsyn",0,0,14.21627502,1.255098069,4.75,1,16,1,1,1,1,1,1,1,1,1,1,1,0
569,Det er et resultat som kan ændre hele verden,9,"resultat, ændre, verden",0,0,32.10930731,1.026914943,6.69,1,16,1,1,1,1,1,1,1,1,1,1,1,1
570,Hun har vistnok hevet i hans fod eller hans ben,10,"hevet, fod, ben",0,0,25.83926713,-0.776134654,5.38,1,16,1,1,1,1,1,1,1,1,1,1,1,1
571,Der er en prins der har lejet min helikopter,1,"prins, lejet, helikopter",0,0,5.444397094,-1.439326939,4.13,0,8,1,1,1,1,1,1,1,1,1,1,1,0
572,Hun var træt fordi hun havde ventet længe på sin mor,2,"træt, ventet, mor",0,0,12.00412634,1.817129129,6.38,0,16,1,1,1,1,1,0,1,1,1,1,1,1
573,Min storebror har virkelig engageret sig i folkeskolen,3,"storebror, engageret, folkeskolen",0,0,15.08315104,3.71564409,6.63,0,8,1,1,1,1,1,1,1,1,1,1,1,1
574,De antydede hvordan vi kan slippe for reklamer,4,"antydede, slippe, reklamer",0,0,12.60804771,0.303607596,5.75,0,8,1,1,1,1,0,1,1,1,1,1,1,1
575,Det var udmærket at de kunne skaffe mere frugt,5,"udmærket, skaffe, frugt",0,0,9.534811644,-1.939111598,5.69,1,16,1,1,1,1,1,1,1,1,0,1,1,1
576,Ude på havet blæser det mere end på kanalen,6,"havet, blæser, kanalen",0,0,11.39644444,-0.36589971,5.56,0,16,1,1,1,1,1,1,1,1,0,1,1,1
577,Bestyrelsen havde involveret mig i deres hemmelighed,7,"bestyrelsen, involveret, hemmelighed",0,0,7.849116697,-1.034510933,6,0,16,1,1,1,1,1,1,1,1,1,1,1,1
578,Hun udtrykte tydeligt at hun ikke behøver betaling,8,"udtrykte, behøver, betaling",0,0,7.477398692,-3.032527123,4.94,1,16,1,1,1,1,1,1,1,1,1,1,1,1
579,Det var vores hund som havde lagt sig på sengen,9,"hund, lagt, sengen",0,0,12.10918588,0.824937228,6.06,0,16,1,1,1,1,1,1,1,1,0,1,1,1
580,De indtog store mængder kød under middagen,10,"indtog, kød, middagen",0,0,27.44873002,-0.483666782,6.31,0,16,1,1,1,1,1,1,1,1,0,1,1,1
581,Der var en skoleelev der savnede udfordringer,1,"skoleelev, savnede, udfordringer",0,0,12.50085985,-2.498678767,6.5,0,8,1,1,1,1,1,0,1,1,1,1,1,1
582,Vi er meget tilfredse selvom der mangler asier,2,"tilfredse, mangler, asier",0,0,7.702251055,1.561675926,5.59,1,17,1,1,1,1,1,0,1,1,1,1,1,1
583,Prinsen ville faktisk helst hvile sig på sit slot,3,"prinsen, hvile, slot",0,0,11.97153204,1.685323587,6,0,16,1,1,1,1,1,1,1,1,0,1,1,1
584,Vi diskuterer hvornår vi kan overtage jeres opgaver,4,"diskuterer, overtage, opgaver",0,0,10.68549725,1.725193754,6.13,2,16,1,1,1,1,1,1,1,1,1,1,1,1
585,Det er så heldigt at din mormor kan strikke,5,"heldigt, mormor, strikke",0,0,16.86590231,-0.549370451,6.88,0,8,1,1,1,1,1,1,1,1,1,1,1,1
586,I november skal jeg dokumentere mine udgifter,6,"november, dokumentere, udgifter",0,0,24.21898451,0.290960908,5.81,2,16,1,1,1,1,1,1,1,1,1,1,1,1
587,Min nabo overraskede mig ofte med sine ideer,7,"nabo, overraskede, ideer",0,0,21.57430692,0.338323572,6.25,0,16,1,1,1,1,1,1,1,1,1,1,1,1
588,Hun beklager sig over at vi skal sove på en båd,8,"beklager, sove, båd",0,0,10.52244288,-0.599437249,6.71,0,17,1,1,1,1,1,1,1,1,1,1,1,1
589,Det er en kvinde som skal afløse premierministeren,9,"kvinde, afløse, premierministeren",0,0,16.61890421,1.129453629,6.24,0,17,1,1,1,1,1,1,1,1,1,1,1,1
590,Han var stukket af med sin brud og sin formue,10,"stukket, brud, formue",0,0,14.12191039,-1.413252341,5.76,0,17,1,1,1,1,1,1,1,1,1,1,1,1
591,Der er nogle spillere der kan svække landsholdet,1,"spillere, svække, landsholdet",0,0,10.43435711,-1.868879359,6,0,16,1,1,1,1,1,1,1,1,1,1,1,1
592,Han var rolig fordi han havde fået en garanti,2,"rolig, fået, garanti",0,0,18.51750064,0.278569162,6.31,0,16,1,1,1,1,1,1,1,1,1,1,1,1
593,De har heldigvis udsat folkeafstemningen til juli,3,"udsat, folkeafstemningen, juli",0,0,7.575174608,-1.411645831,6.47,0,17,1,1,1,1,1,1,1,1,1,1,1,1
594,Hun vil regulere hvordan vi driver vores organisation,4,"regulere, driver, organisation",0,0,9.603294298,-1.500993332,6.12,1,17,1,1,1,1,1,1,1,1,0,1,1,1
595,Det var fantastisk at hun havde udarbejdet en teori,5,"fantastisk, udarbejdet, teori",0,0,6.074799445,0.626722156,6.18,1,17,1,1,1,1,1,1,1,1,1,1,1,1
596,I aften skal vi igen underholde alle tilskuerne,6,"aften, underholde, tilskuerne",0,0,17.664788,2.275111217,6.19,0,16,1,1,1,1,1,1,1,1,1,1,1,1
597,Jeg har netop købt en plante til mit ældste barn,7,"købt, plante, barn",0,0,19.09226754,0.991034091,6.75,0,16,1,1,1,1,1,0,1,1,1,1,1,1
598,Han formoder nok at vi modtager hans tilbud,8,"formoder, modtager, tilbud",0,0,29.93312531,-2.379546167,6,0,8,1,1,1,1,1,1,1,1,1,1,1,1
599,Det var en forfatter som talte om vores landsby,9,"forfatter, talte, landsby",0,0,17.09634588,0.511836545,6.38,0,16,1,1,1,1,1,0,1,1,1,1,1,0
600,Eksperterne har netop informeret os om udviklingen,10,"eksperterne, informeret, udviklingen",0,0,11.73268928,1.243135085,6.75,0,8,1,1,1,1,0,1,1,1,1,1,1,1
601,Der er mange kritikere der roser mine digte,1,"kritikere, roser, digte",0,0,22.06823897,-0.720483666,6,0,8,1,1,1,1,1,1,1,1,1,1,1,1
602,Hun var vred fordi hendes data var forsvundet,2,"vred, data, forsvundet",0,0,15.36230693,2.956316796,6.38,1,8,1,1,1,1,1,1,1,1,1,1,1,1
603,Formanden havde grinet meget af min forklaring,3,"formanden, grinet, forklaring",0,0,14.11713745,-1.1347233,5.88,0,8,1,1,1,1,1,1,1,1,1,1,1,1
604,Han har desværre glemt hvor han placerede sine nøgler,4,"glemt, placerede, nøgler",0,0,6.61360661,-1.954717986,3.88,0,8,1,1,1,1,1,1,1,1,1,1,1,1
605,Det var positivt at vælgerne straks reagerede,5,"positivt, vælgerne, reagerede",0,0,30.3713714,-0.354868687,6.22,0,9,1,1,1,1,1,1,1,1,1,1,1,1
606,Inden morgenmaden opholder han sig i sin have,6,"morgenmaden, opholder, have",0,0,27.05451619,-1.647975884,6.13,0,8,1,1,1,1,1,1,1,1,1,1,1,1
607,Fabrikken giver os stadigvæk et overskud,7,"fabrikken, giver, overskud",0,0,8.399219395,-3.439088859,6,0,9,1,1,1,1,1,1,1,0,1,1,0,0
608,Hun anslog at man kunne forlænge uddannelsen,8,"anslog, forlænge, uddannelsen",0,0,32.3447783,-1.083510119,4.33,0,9,1,1,1,1,1,0,1,0,1,1,1,1
609,Det var vores koncern som betalte for arrangementet,9,"koncern, betalte, arrangementet",0,0,18.88100435,0.276669247,6.13,0,8,1,1,1,1,1,1,1,1,1,1,1,1
610,Han måtte beholde både gaven og erstatningen,10,"beholde, gaven, erstatningen",0,0,20.43171882,-0.15186431,6,0,9,1,1,1,1,1,1,1,1,1,1,1,1
611,Der var to sangere der begge havde studeret litteratur,1,"sangere, studeret, litteratur",0,0,17.53263018,1.001083856,6,0,8,1,1,1,1,1,1,1,1,0,1,1,1
612,Han er professionel når han optager et interview,2,"professionel, optager, interview",0,0,8.361008897,3.689148894,5.88,0,8,1,1,1,1,0,1,1,1,1,1,0,1
613,Hendes kæreste vil modtage hende i lufthavnen,3,"kæreste, modtage, lufthavnen",0,0,14.97134334,0.936602065,4.89,0,9,1,1,1,1,1,0,1,1,1,1,1,1
614,Jeg noterede hvornår de havde truffet forfatteren,4,"noterede, truffet, forfatteren",0,0,23.72793123,-0.144200558,5,0,8,1,1,1,1,1,1,1,1,1,1,1,1
615,Det er naturligt at man varetager sine egne interesser,5,"naturligt, varetager, interesser",0,0,17.62656417,3.017794392,6.13,0,8,1,1,1,1,1,1,1,1,1,1,1,1
616,I vores have vil vi gerne dyrke flere gulerødder,6,"have, dyrke, gulerødder",0,0,13.11413335,-1.084626201,6.38,0,8,1,1,1,1,1,1,1,1,1,1,1,1
617,Vores analytikere kan rådgive jer om aktier,7,"analytikere, rådgive, aktier",0,0,14.0230838,-0.883372419,6.25,0,8,1,1,1,1,1,1,1,1,0,1,1,1
618,Hun taler altid om at man burde forbyde jagt,8,"taler, forbyde, jagt",0,0,9.950673714,1.879833343,6.63,0,8,1,1,1,1,1,0,1,1,0,1,0,1
619,Det er en kasse som kan rumme mange bøger,9,"kasse, rumme, bøger",0,0,18.07021942,-0.4412916,6,0,8,1,1,1,1,1,1,1,1,0,1,0,1
620,En eller anden har indleveret både et tv og et bord,10,"indleveret, tv, bord",0,0,18.00033722,-1.105787948,6.5,0,8,1,1,1,1,1,1,1,1,0,1,1,1
621,Der er få danskere der beklager sig over lovgivningen,1,"danskere, beklager, lovgivningen",0,0,13.87965552,1.014133859,5.67,0,9,1,1,1,1,1,0,1,1,0,1,1,1
622,De var nøjagtige når de dokumenterede resultaterne,2,"nøjagtige, dokumenterede, resultaterne",0,0,11.99388623,0.192028227,4.63,0,8,1,1,0,1,1,1,1,1,1,1,1,1
623,Vi skal overbevise ministeren med vores argumenter,3,"overbevise, ministeren, argumenter",0,0,10.87147544,0.493052959,5.88,0,8,1,1,1,1,1,1,1,1,1,1,1,1
624,Hun burde have lært hvordan man pakker en kuffert,4,"lært, pakker, kuffert",0,0,24.65827767,0.647169488,6.38,0,8,1,1,1,1,0,1,1,1,1,1,1,1
625,Det var sikkert tilfældigt at alle dyrene vågnede,5,"tilfældigt, dyrene, vågnede",0,0,16.81836446,1.005783952,5.75,0,8,1,1,1,1,1,1,1,1,1,1,1,1
626,På mandag kan vi allerede hente vores billetter,6,"mandag, hente, billetter",0,0,11.77283199,0.08480356,4.63,0,8,1,1,1,1,1,1,1,1,1,1,1,1
627,Mine forældre har igen sendt mig en artikel,7,"forældre, sendt, artikel",0,0,14.49216634,0.405742013,6.13,0,8,1,1,1,1,1,1,1,1,1,1,1,1
628,Han skønner at han kan fortsætte i tyve minutter,8,"skønner, fortsætte, minutter",0,0,9.387976743,-0.354531513,5.7,0,10,1,1,1,1,1,1,1,1,0,1,1,1
629,Det var bare varmen som havde udvidet træet,9,"varmen, udvidet, træet",0,0,17.10812862,-2.440726847,5.38,0,8,1,1,1,1,1,1,1,1,0,1,1,1
630,Han har fortjent sine rekorder og sine gevinster,10,"fortjent, rekorder, gevinster",0,0,17.67906665,0.970393889,5.25,0,8,1,1,1,1,1,1,1,1,0,1,1,1
631,Der var en hel del der efterlyste flere forbedringer,1,"del, efterlyste, forbedringer",0,0,15.05737343,-0.476108311,5.5,0,8,1,1,1,1,1,1,1,1,0,1,1,1
632,Hun er lidt flov fordi hun bankede i bordet,2,"flov, bankede, bordet",0,0,11.90563772,-0.752830808,5.11,0,9,1,1,1,1,1,1,1,1,1,1,1,1
633,Nogen har stillet en enorm sten nede ved kanalen,3,"stillet, sten, kanalen",0,0,7.510591936,-1.526793738,5.44,0,9,1,1,1,1,1,1,1,1,0,1,1,1
634,De overvejede hvornår de skulle besøge rådhuset,4,"overvejede, besøge, rådhuset",0,0,9.48472079,1.107107532,6.22,0,9,1,1,1,1,1,1,1,1,1,1,1,0
635,Det er muligt at man kan kontrollere sin fremtid,5,"muligt, kontrollere, fremtid",0,0,15.41638829,1.567490939,4.75,0,8,1,1,1,1,1,1,1,1,1,1,1,1
636,På onsdag skal jeg koncentrere mig om klubben,6,"onsdag, koncentrere, klubben",0,0,11.30311955,1.142547955,5.56,0,9,1,1,1,1,1,1,1,1,0,1,1,1
637,Han har baseret sin vurdering på de her informationer,7,"baseret, vurdering, informationer",0,0,19.04550564,-0.303840255,5.88,0,8,1,1,1,1,1,0,1,1,1,1,1,1
638,Det kan medføre at vi forlænger vores samarbejde,8,"medføre, forlænger, samarbejde",0,0,17.24829814,-0.02314972,5.13,0,8,1,1,1,1,1,1,1,1,1,1,1,1
639,Det er statsministeren som indkaldte til en konference,9,"statsministeren, indkaldte, konference",0,0,10.60612471,0.891286321,4.38,0,8,1,1,1,1,1,1,1,1,1,1,0,1
640,Katten havde selvfølgelig anbragt sig på min ryg,10,"katten, anbragt, ryg",0,0,12.89423002,-1.362912188,4.88,1,8,1,1,1,1,1,1,1,1,1,1,0,1
641,Der er ingen meningsmålinger der ryster finansministeren,1,"meningsmålinger, ryster, finansministeren",0,0,8.938243774,-4.151649629,6.25,0,8,1,1,1,1,1,0,1,1,1,1,0,1
642,Hun var rolig mens hun dansede med kongen,2,"rolig, dansede, kongen",0,0,9.376263857,-0.668224249,6.38,0,8,1,1,1,1,1,1,1,1,1,1,1,1
643,De vil bygge et stadion i nærheden af operaen,3,"bygge, stadion, operaen",0,0,9.495379837,0.502940001,6.88,0,8,1,1,1,1,1,1,1,1,1,1,1,1
644,Vi skal kigge på hvordan vi kan fastholde publikum,4,"kigge, fastholde, publikum",0,0,7.439650333,1.632530437,6.5,0,8,1,1,1,1,1,1,1,1,0,1,1,1
645,Det var utroligt at han kunne gribe alle æggene,5,"utroligt, gribe, æggene",0,0,12.39184905,-0.316316276,6,0,8,1,1,1,1,1,1,1,1,1,1,1,1
646,I næste uge skal de faktisk bo i vores landsby,6,"uge, bo, landsby",0,0,18.86955825,0.256005153,6.13,0,8,1,1,1,0,1,1,1,1,0,1,1,1
647,Jeg har allerede givet min mor en overraskelse,7,"givet, mor, overraskelse",0,0,19.01752761,0.424233102,6.63,0,8,1,1,1,1,1,1,1,1,0,1,1,1
648,Han accepterede at vi kogte lidt mere te til ham,8,"accepterede, kogte, te",0,0,9.940781224,-0.756041784,4.5,0,8,1,0,1,1,1,1,1,1,1,1,1,1
649,Det var en dansker som vandt sidste tirsdag,9,"dansker, vandt, tirsdag",0,0,15.74560764,1.694355365,6.13,0,8,1,1,1,1,0,0,1,1,1,1,0,1
650,Han havde kastet sin stol helt ud af rummet,10,"kastet, stol, rummet",0,0,10.36898639,1.356985283,5.25,1,8,1,1,1,1,1,1,1,1,1,1,1,0
651,Der var en leverandør der selv varetog al transport,1,"leverandør, varetog, transport",0,0,4.814536069,-0.089374958,5.13,0,8,1,1,1,1,1,1,1,1,1,1,1,1
652,Jeg bliver varm hvis jeg ligger længe på stranden,2,"varm, ligger, stranden",0,0,153.6563952,0.052508761,6.63,0,8,1,1,1,1,1,0,1,1,0,1,1,1
653,En af fotograferne løb simpelthen efter dronningen,3,"fotograferne, løb, dronningen",0,0,13.01663756,-1.105348359,6,1,8,1,1,1,1,1,1,1,1,0,1,0,1
654,Hun antydede kun hvilke aktier vi skulle frasælge,4,"antydede, aktier, frasælge",0,0,12.47652233,1.225106661,5,0,8,1,0,1,1,0,1,1,1,0,1,1,1
655,Det er helt centralt at vi forhindrer flere konflikter,5,"centralt, forhindrer, konflikter",0,0,9.236620321,1.298936522,6,0,8,1,1,1,1,1,1,1,1,1,1,1,1
656,I marts skal vi have formuleret vores strategi,6,"marts, formuleret, strategi",0,0,15.25342916,-0.888517609,5.5,0,8,1,1,1,1,1,1,1,1,1,1,0,1
657,Dit brev mindede mig om vores sommerferie,7,"brev, mindede, sommerferie",0,0,37.89335886,-0.859743178,6.88,0,8,1,1,1,1,1,1,1,1,1,1,1,1
658,De har glemt at de også skal overholde reglerne,8,"glemt, overholde, reglerne",0,0,34.92334156,1.321559884,6.13,1,8,1,1,1,1,1,1,1,1,0,1,1,1
659,Det er en retssag som kan knuse fagforeningen,9,"retssag, knuse, fagforeningen",0,0,27.75046314,-1.320279297,6.25,0,8,1,1,1,1,1,1,1,1,0,1,1,1
660,Han havde indrettet sig i et hus nede ved havnen,10,"indrettet, hus, havnen",0,0,21.97412452,0.252998578,6,0,8,1,1,1,1,1,1,1,1,1,1,1,1
661,Der er flere blade der har citeret min rapport,1,"blade, citeret, rapport",0,0,11.38801435,0.92921699,5.56,0,9,1,1,1,1,1,1,1,1,1,1,1,1
662,Hun er urimelig hvis hun afviser vores tilgang,2,"urimelig, afviser, tilgang",0,0,44.58052061,0.539869576,5.67,0,9,1,1,1,1,1,1,1,1,1,1,1,1
663,Min kone administrerer alle vores forsikringer,3,"kone, administrerer, forsikringer",0,0,13.60269077,-0.594335171,6.5,2,10,1,1,1,1,1,1,0,1,1,1,1,1
664,De har vist forstået hvorfor vi vil skubbe datoen,4,"forstået, skubbe, datoen",0,0,16.11222203,-0.585800219,6.11,0,9,1,1,1,1,1,1,1,1,1,1,1,1
665,Det var interessant at vi godt måtte afbryde ordføreren,5,"interessant, afbryde, ordføreren",0,0,6.316129055,-2.422185264,5.56,0,9,1,1,1,1,1,1,1,1,1,1,0,1
666,Næste sommer vil jeg udgive mine erindringer,6,"sommer, udgive, erindringer",0,0,13.36250919,-0.331635819,6.2,0,10,1,1,1,1,1,1,1,1,1,1,0,0
667,Jeres repræsentant har oplyst os om vilkårene,7,"repræsentant, oplyst, vilkårene",0,0,11.86650716,-0.371036055,6.9,0,10,1,1,1,1,1,1,1,1,0,1,1,1
668,Man kan bevise at vores produkt ikke skader miljøet,8,"bevise, produkt, miljøet",0,0,29.14851835,2.04026324,5.9,0,10,1,1,1,1,1,1,1,1,0,1,1,1
669,Det var det her kapitel som irriterede forlaget,9,"kapitel, irriterede, forlaget",0,0,12.14316628,-2.122697282,6.3,0,10,1,1,1,1,1,1,1,1,0,1,1,1
670,Krukkerne har overlevet både transporten og kulden,10,"krukkerne, overlevet, kulden",0,0,20.68401086,0.694405434,5.88,0,8,1,1,1,1,1,1,0,1,0,1,1,1
671,Der var flere brugere der udtrykte deres tilfredshed,1,"brugere, udtrykte, tilfredshed",0,0,10.63529424,0.61567459,6.63,0,8,1,1,1,1,1,1,1,0,1,1,0,1
672,Han var meget flittig fordi han skulle deltage i et show,2,"flittig, deltage, show",0,0,26.70488713,-0.525196496,5.78,0,9,1,1,1,1,1,1,1,1,1,1,1,1
673,Vores medlemmer vil gerne praktisere deres kunst,3,"medlemmer, praktisere, kunst",0,0,19.95334552,2.39480465,6.5,0,8,1,1,1,1,1,1,1,1,0,1,0,1
674,Jeg nævnte hvornår de kunne træffe ejeren,4,"nævnte, træffe, ejeren",0,0,8.727749418,-1.684801278,6.11,1,9,1,1,1,1,1,1,1,1,0,1,1,1
675,Det var underligt at de måtte beholde fabrikken,5,"underligt, beholde, fabrikken",0,0,12.59280478,-0.875778229,5.9,0,10,1,1,1,1,1,1,1,1,0,1,1,1
676,I virkeligheden savnede hun faktisk lidt modstand,6,"virkeligheden, savnede, modstand",0,0,14.83082663,-0.009862162,6.89,0,9,1,1,1,1,1,1,1,1,1,1,1,1
677,Hun kan lige dække omkostningerne med sin løn,7,"dække, omkostningerne, løn",0,0,14.77423076,0.628415092,6.78,0,9,1,1,1,1,1,1,1,1,0,1,1,0
678,Vi troede at du ville rydde op i hele bygningen,8,"troede, rydde, bygningen",0,0,4.634840786,-4.699935608,6.3,0,10,1,1,1,1,1,1,1,1,1,1,1,1
679,Det er en aftale som kan tilfredsstille mindretallet,9,"aftale, tilfredsstille, mindretallet",0,0,8.311356757,-0.075205856,6.3,0,10,1,1,1,1,1,1,1,1,1,1,1,1
680,Hun har ofte beskrevet bjerget og dets indbyggere,10,"beskrevet, bjerget, indbyggere",0,0,12.83615188,-0.903516165,5.11,0,9,1,1,1,1,1,1,1,1,1,1,1,1
681,Der er mange svenskere der følger mine råd,1,"svenskere, følger, råd",0,0,9.453568665,-1.373134841,6.5,0,10,1,1,1,1,1,1,1,1,1,1,1,1
682,Vi er ret lykkelige når vi spiser middag sammen,2,"lykkelige, spiser, middag",0,0,224.7758705,0.202702987,6.1,0,10,1,1,1,1,1,0,1,1,1,1,1,1
683,Borgmesteren ville involvere mig i sin dagsorden,3,"borgmesteren, involvere, dagsorden",0,0,22.64813836,1.799047233,4.8,1,10,1,1,1,1,1,1,1,1,1,1,0,1
684,Hun ville gerne se hvem der udførte aktionen,4,"se, udførte, aktionen",0,0,15.30127334,1.083558887,5.9,0,10,1,1,0,1,1,1,1,1,1,1,1,1
685,Det er interessant at de gennemførte finansloven,5,"interessant, gennemførte, finansloven",0,0,8.287369611,0.470733312,5.3,0,10,1,1,1,1,1,0,1,1,0,1,1,0
686,I juni vil de desværre rulle alle reformerne tilbage,6,"juni, rulle, reformerne",0,0,18.57776346,-3.085903085,5.9,0,10,1,1,1,1,1,1,1,1,1,1,0,0
687,Min kammerat har anbefalet mig den her øl,7,"kammerat, anbefalet, øl",0,0,20.66332178,-0.465702474,6.6,0,10,1,1,1,1,1,1,1,1,1,1,1,1
688,Vi syntes alle at han skulle afslutte sin historie,8,"syntes, afslutte, historie",0,0,20.4760176,1.908646381,6.2,0,10,1,1,1,1,1,1,1,1,1,1,1,1
689,Det var kun kirken som kunne samle indbyggerne,9,"kirken, samle, indbyggerne",0,0,11.48435805,-0.290034589,6,0,9,1,1,1,1,1,1,1,1,1,1,1,1
690,Jeg vil snart anskaffe mig en elbil eller en cykel,10,"anskaffe, elbil, cykel",0,0,23.66836144,0.349231171,6.88,0,8,1,1,1,1,1,1,1,1,0,1,1,1
691,Der var mange eksempler der illustrerede den her pointe,1,"eksempler, illustrerede, pointe",0,0,8.126384372,0.165281874,5.6,0,10,1,1,1,1,1,1,1,1,1,1,1,1
692,Hun var opmærksom fordi hun klippede sit hår,2,"opmærksom, klippede, hår",0,0,10.3232988,-0.608324306,4.88,0,8,1,1,1,1,1,1,1,1,1,1,1,1
693,Nogen havde tegnet et ansigt på min skærm,3,"tegnet, ansigt, skærm",0,0,39.23367596,1.660462208,6.4,0,10,1,1,1,1,1,1,1,1,1,1,1,0
694,Vi regnede ud hvor man kunne skrue op for vandet,4,"regnede, skrue, vandet",0,0,22.49406806,-0.570642573,5.8,0,10,1,1,1,1,1,1,1,1,1,1,1,1
695,Det var hurtigt at professoren tilegnede sig stoffet,5,"hurtigt, professoren, stoffet",0,0,9.557706542,0.287926577,5.13,0,8,1,1,1,1,1,1,1,1,1,1,1,1
696,For tiden føler hun sig heldigvis rimeligt frisk,6,"tiden, føler, frisk",0,0,23.18302353,-0.638864422,6.22,0,9,1,1,1,1,1,1,1,1,1,1,1,1
697,Mægleren har allerede oplyst os om ejendommen,7,"mægleren, oplyst, ejendommen",0,0,33.19955067,-1.182256155,6.63,0,8,1,1,1,1,0,1,1,1,0,1,1,1
