Number,Sentence,Template,Keywords,A_F1_Lists,AV_F1_Lists,Slope,Offset,Naturalness,Discomfort,Responses,Audio_screening_F1,Linguistics_screening_F1,Video_screening_F1,Audio_screening_F2,Linguistics_screening_F2,Video_screening_F2,Audio_screening_M1,Linguistics_screening_M1,Video_screening_M1,Audio_screening_M2,Linguistics_screening_M2,Video_screening_M2
349,Det var en af sangerne som forsvandt i pausen,9,"sangerne, forsvandt, pausen",0,0,16.05793152,1.491027923,4.81,0,16,1,1,1,1,1,1,1,1,1,1,1,1
350,Man skal helst både rulle og sprede dejen,10,"rulle, sprede, dejen",0,0,8.08642153,-5.059037271,4.2,0,15,1,1,1,1,1,0,1,1,1,1,1,1
351,Der er en kat der gemmer sig bag blomsterne,1,"kat, gemmer, blomsterne",0,0,10.16507222,2.753594608,6.35,0,17,1,1,1,1,1,1,1,0,1,1,1,1
352,Hun er nervøs fordi vi inviterede hende ud på slottet,2,"nervøs, inviterede, slottet",0,0,9.890224323,0.277816191,5.57,0,14,1,1,1,1,1,1,1,1,1,1,1,0
353,De burde fjerne de der figurer fra vores park,3,"fjerne, figurer, park",0,0,7.736353427,-0.301416163,5.81,0,16,1,1,1,1,1,1,1,1,0,1,1,1
354,Vi har skrevet ned hvordan vi plejer at gøre,4,"skrevet, plejer, gøre",0,0,27.6950185,1.547930108,6.4,0,15,1,1,1,1,1,1,0,1,1,1,1,1
355,Det var ærgerligt at vi sprang over maden,5,"ærgerligt, sprang, maden",0,0,7.927436739,0.62643273,3.47,2,15,1,1,1,1,1,1,1,1,1,1,1,1
356,Om natten kravlede musene rundt oppe under taget,6,"natten, kravlede, taget",0,0,16.96702905,-0.189418252,6.5,0,8,1,1,1,1,1,1,1,1,1,1,0,1
357,Jeg havde oplyst kunden om det præcise beløb,7,"oplyst, kunden, beløb",0,0,17.11620606,-0.168741128,6.75,0,16,1,1,1,1,1,1,1,1,0,1,0,1
358,Det betød at de skulle ansætte flere dommere,8,"betød, ansætte, dommere",0,0,12.02903549,0.08205393,6.27,0,15,1,1,1,1,1,1,1,1,1,1,1,1
359,Det er kun domstolen som kan dømme i sagen,9,"domstolen, dømme, sagen",0,0,25.70263273,-0.503210774,6.67,0,15,1,1,1,1,1,0,1,1,1,1,1,1
360,Vores magasin vil gerne udgive flere digte,10,"magasin, udgive, digte",0,0,8.768209049,-1.210900106,5.93,0,15,1,1,1,1,1,1,1,1,0,1,1,1
361,Der var et skib der landede i en jysk havn,1,"skib, landede, havn",0,0,27.75199808,1.179747369,3.44,0,16,1,1,1,1,1,0,1,1,1,1,1,1
362,Jeg var venlig selvom de fastholdt deres kritik,2,"venlig, fastholdt, kritik",0,0,13.80281188,0.206273743,6,0,16,1,1,1,1,1,1,1,1,1,1,1,1
363,Hans forskning indgik naturligt i undervisningen,3,"forskning, indgik, undervisningen",0,0,29.40119486,-1.73530755,6.63,1,16,1,1,1,1,0,1,1,0,1,1,1,1
364,Hun vil vise os hvordan hun angreb problemet,4,"vise, angreb, problemet",0,0,9.372007374,-1.826632569,5.25,0,16,1,1,1,1,1,0,1,1,1,1,1,1
365,Det er meget vigtigt at de udbreder den information,5,"vigtigt, udbreder, information",0,0,11.73094318,0.170066824,5.63,0,8,1,1,1,1,1,1,1,1,0,1,1,1
366,Efter skolen havnede han vistnok på gymnasiet,6,"skolen, havnede, gymnasiet",0,0,12.67231745,-0.981875004,6.25,0,8,1,1,1,1,1,1,1,1,0,1,1,1
367,Vi kan skræddersy en løsning til jeres virksomhed,7,"skræddersy, løsning, virksomhed",0,0,21.59092636,3.395714287,6.75,0,8,1,1,1,0,1,1,1,1,1,1,1,1
368,De havde valgt at inddrage alt personalet,8,"valgt, inddrage, personalet",0,0,12.22971006,-1.1509857,6.69,0,16,1,1,1,1,1,1,1,1,1,1,1,1
369,Det var et eventyr som fascinerede min søn,9,"eventyr, fascinerede, søn",0,0,12.58410712,-0.965823937,6.31,0,16,1,1,1,1,1,1,1,1,0,1,1,1
370,Han forsøger at opbygge et netværk og en portefølje,10,"forsøger, opbygge, portefølje",0,0,6.437859318,0.268653448,6.75,0,8,1,1,1,1,1,1,1,1,1,1,1,1
371,Der er ret mange briter der elsker sport,1,"briter, elsker, sport",0,0,30.20276167,-1.17936384,6.25,1,16,1,1,1,1,1,1,1,0,1,1,1,1
372,Hun er sur fordi vi har rykket rundt på datoerne,2,"sur, rykket, datoerne",0,0,9.893732435,0.855110059,6.81,1,16,1,1,1,1,1,1,1,1,1,1,1,1
373,Han har fjernet al musikken fra forestillingen,3,"fjernet, musikken, forestillingen",0,0,8.807386716,1.285722221,6.38,1,16,1,1,1,1,1,1,1,1,0,1,1,1
374,I kan godt regne ud hvorfor vi måler resultaterne,4,"regne, måler, resultaterne",0,0,13.8204645,-1.778221878,5.5,1,16,1,1,1,1,1,1,1,1,1,1,1,1
375,Det var fint at de samarbejdede med oppositionen,5,"fint, samarbejdede, oppositionen",0,0,9.049247279,0.777478754,6.56,1,16,1,1,1,1,1,1,1,1,1,1,0,1
376,I den her sal plejer vi at danse uden sko,6,"sal, danse, sko",0,0,89.63109733,-1.666084243,6.19,0,16,1,1,1,1,1,1,1,1,1,1,1,1
377,De ville flytte al maden ned til stranden,7,"flytte, maden, stranden",0,0,19.96556013,-0.145651097,5.19,0,16,1,1,1,1,1,1,1,1,1,1,1,1
378,Vi forudså at vi ville opnå en forbedring,8,"forudså, opnå, forbedring",0,0,15.45543434,-1.474918139,6.13,0,16,1,1,1,1,1,1,1,1,1,1,0,1
379,Det er et lys som kan brænde i tre døgn,9,"lys, brænde, døgn",0,0,9.851998328,-0.505104866,6.25,0,16,1,1,1,1,1,1,1,1,1,1,1,1
380,Vi vil gerne tilpasse vores varer til markedet,10,"tilpasse, varer, markedet",0,0,13.19329038,0.903506361,6.25,1,16,1,1,1,1,1,1,1,1,1,1,1,1
381,Der var en rådgiver der analyserede valget,1,"rådgiver, analyserede, valget",0,0,13.26825528,-0.030701562,5.33,0,15,1,1,0,1,1,1,1,1,1,1,1,1
382,Jeg er grundig når jeg formulerer en annonce,2,"grundig, formulerer, annonce",0,0,26.10563913,-1.088991673,5.94,0,16,1,1,1,1,1,1,1,1,1,1,1,1
383,Hun har mødt vedkommende i hemmelighed,3,"mødt, vedkommende, hemmelighed",0,0,12.13461748,-3.229616521,5.43,0,14,1,1,0,1,1,1,1,1,0,1,1,1
384,Han nævnte hvem der havde løst vores problem,4,"nævnte, løst, problem",0,0,16.20799609,0.233630208,5.87,0,15,1,1,1,1,1,0,1,1,0,1,1,1
385,Det er forståeligt at hun steg så hurtigt i graderne,5,"forståeligt, steg, graderne",0,0,14.98471416,-0.816547956,6.38,0,8,1,1,1,1,0,0,1,1,1,1,1,1
386,I vores kvarter låser vi nærmest aldrig dørene,6,"kvarter, låser, dørene",0,0,44.50605835,-0.213223026,6.53,0,15,1,1,1,1,1,1,1,1,0,1,1,1
387,Den her vej fører jer direkte ind til centrum,7,"vej, fører, centrum",0,0,32.04681001,2.109486019,6.27,0,15,1,1,1,1,1,1,1,0,1,1,1,1
388,Vi risikerer at de vil gennemgå vores regnskab,8,"risikerer, gennemgå, regnskab",0,0,14.51715044,0.993165334,6.25,0,16,1,1,1,1,1,1,1,1,1,1,0,1
389,Det var det lave tryk som skabte stormen,9,"tryk, skabte, stormen",0,0,28.71372638,1.81648889,6.25,0,8,1,1,1,1,1,1,0,1,0,1,1,1
390,Han har tjent og videregivet en hel masse penge,10,"tjent, videregivet, penge",0,0,8.63200197,-0.082599404,6.25,0,8,1,1,1,1,1,1,1,1,0,1,0,1
391,Der er mange musikere der nyder godt af festivalerne,1,"musikere, nyder, festivalerne",0,0,11.87517178,-1.585775069,6.44,0,16,1,1,1,1,1,1,1,1,0,1,1,1
392,Hun var meget opmærksom når hun kogte pasta,2,"opmærksom, kogte, pasta",0,0,5.204578602,-5.201009011,6.25,0,8,1,1,1,1,1,1,1,1,1,1,1,1
393,Museet befinder sig i en skov tæt ved søen,3,"museet, skov, søen",0,0,13.79673842,2.405524842,6,0,15,1,1,1,1,1,1,1,0,0,1,1,1
394,Han har indset hvor afgørende det er at forhandle,4,"indset, afgørende, forhandle",0,0,28.7723319,0.537356097,6.44,0,16,1,1,1,1,1,1,1,1,1,1,1,1
395,Det var hemmeligt at vi havde lavet en film,5,"hemmeligt, lavet, film",0,0,18.39323838,-2.853535415,6.29,0,14,1,1,1,1,1,1,1,1,1,1,1,1
396,I næste sæson kan de kvalificere sig til superligaen,6,"sæson, kvalificere, superligaen",0,0,10.41537447,2.673896549,6.8,0,15,1,1,1,1,1,1,1,1,1,1,1,1
397,Hun takkede igen sin bror for mobiltelefonen,7,"takkede, bror, mobiltelefonen",0,0,21.73152685,-1.456428989,6.13,0,16,1,1,1,1,1,1,1,1,1,1,1,1
398,Han drømte ofte at han flød ned ad en varm flod,8,"drømte, varm, flod",0,0,8.823160123,-0.918651887,4.75,0,8,1,1,1,1,1,1,1,1,0,1,1,1
399,Det er dit orkester som skal underholde pensionisterne,9,"orkester, underholde, pensionisterne",0,0,17.23081528,0.305779476,6.29,0,14,1,1,1,1,1,1,1,1,1,1,1,1
400,Han reddede både sin kone og ven i sikkerhed,10,"reddede, kone, sikkerhed",0,0,47.16189691,-2.859194796,6.14,0,14,1,1,1,1,1,1,1,1,1,1,1,1
401,Der var en dreng der havde pustet balloner op,1,"dreng, pustet, balloner",0,0,9.943697566,-2.058110967,5.63,0,8,1,1,1,1,1,1,1,1,1,1,1,1
402,Han bliver ivrig når I kommenterer hans værk,2,"ivrig, kommenterer, værk",0,0,19.66864056,-2.207353792,6.13,0,8,1,1,1,1,1,1,1,1,1,1,1,1
403,Vores træner var desværre steget på et andet tog,3,"træner, steget, tog",0,0,7.436974466,-0.855073133,5.69,1,13,1,1,1,1,1,1,1,1,1,1,1,1
404,Han spurgte om hvordan man fremstiller papir,4,"spurgte, fremstiller, papir",0,0,4.893955244,-0.884823023,4.85,1,13,1,1,1,1,1,0,1,1,1,1,1,1
405,Det er skønt at I vil overholde vores aftale,5,"skønt, overholde, aftale",0,0,9.659068886,0.929522476,5.88,0,8,1,1,1,1,0,0,1,1,1,1,1,1
406,I juli flyver min kæreste og jeg til udlandet,6,"juli, flyver, udlandet",0,0,21.62616007,-1.142423185,5.79,1,14,1,1,1,1,1,0,1,1,0,1,0,1
407,Vi skal bære alle møblerne op på femte sal,7,"bære, møblerne, sal",0,0,241.7613481,0.212017337,6.79,0,14,1,1,1,1,1,1,1,1,0,1,1,1
408,De tror vist at vi vil hilse på udenrigsministeren,8,"tror, hilse, udenrigsministeren",0,0,6.794052334,1.26812093,5.57,0,14,1,1,1,1,1,1,1,1,0,1,0,1
409,Det var politikerne som dominerede debatten,9,"politikerne, dominerede, debatten",0,0,34.01273144,-2.739252242,6.15,0,13,1,1,1,1,1,1,1,1,1,1,1,0
410,Hun træner især sin mave og sine arme,10,"træner, mave, arme",0,0,22.90837904,1.867891229,5.69,0,13,1,1,1,1,1,1,1,1,1,1,1,1
411,Der er få kommuner der vil skærpe kontrollen,1,"kommuner, skærpe, kontrollen",0,0,16.71033422,-1.616516491,6.14,0,14,1,1,1,1,0,1,1,1,1,1,1,1
412,Hun var usædvanlig fordi hun godt kunne lide regnvejr,2,"usædvanlig, lide, regnvejr",0,0,7.635200572,-3.826610829,5.36,0,14,1,1,1,1,0,1,1,0,1,1,1,1
413,Han var tilknyttet vores institut i det her kvartal,3,"tilknyttet, institut, kvartal",0,0,9.099317858,3.57685901,5.21,1,14,1,1,1,1,1,1,1,1,1,1,1,0
414,De beskrev hvad de havde ordnet ved knallerten,4,"beskrev, ordnet, knallerten",0,0,24.05593583,-2.058356899,5.38,0,8,1,1,1,1,1,1,1,1,0,1,1,1
415,Det var sjovt at hunden vendte sig mod en dame,5,"sjovt, hunden, dame",0,0,9.336821478,0.181316877,4.92,0,13,1,1,1,1,1,1,1,1,1,1,1,1
416,I februar skal jeg optræde med mit band,6,"februar, optræde, band",0,0,14.04770437,2.217539742,6.29,0,14,1,1,1,0,1,1,1,1,1,1,1,1
417,Vi skal fordele alt udstyret blandt deltagerne,7,"fordele, udstyret, deltagerne",0,0,16.68620711,0.501555033,6.36,0,14,1,1,1,1,1,1,1,1,1,1,1,1
418,De gentog at man ikke må røre ved bilerne,8,"gentog, røre, bilerne",0,0,9.407781809,0.235074091,5.71,0,14,1,1,1,1,1,1,1,1,1,1,1,1
419,Det er en strategi som kan begrænse truslen,9,"strategi, begrænse, truslen",0,0,7.320658299,1.21806448,5.64,0,14,1,1,1,1,1,1,1,1,1,1,1,1
420,Protesterne bredte sig hurtigt til hele byen,10,"protesterne, bredte, byen",0,0,17.07641375,0.168975366,5.93,0,14,1,1,1,1,1,0,1,1,1,1,1,1
421,Der var et krydderi der forstærkede smagen,1,"krydderi, forstærkede, smagen",0,0,9.139823246,0.848864705,6.2,0,15,1,1,1,1,1,1,1,1,1,1,1,1
422,Vi er lidt urolige fordi det blæser meget på havet,2,"urolige, blæser, havet",0,0,10.49944676,-1.300864311,6,1,15,1,1,1,1,1,1,1,1,1,1,0,1
423,Jeg havde faktisk læst hele teksten i pausen,3,"læst, teksten, pausen",0,0,13.23848235,2.210893517,6.53,0,15,1,1,1,1,1,1,1,1,1,1,1,1
424,Han vidste at de skulle grave længe efter skatten,4,"vidste, grave, skatten",0,0,21.84410774,2.51196601,6.75,0,8,1,1,1,1,1,0,1,1,0,1,1,1
425,Det er romantisk at han giftede sig med sin sygeplejerske,5,"romantisk, giftede, sygeplejerske",0,0,17.50019888,1.566895952,6.5,0,8,1,1,1,1,1,1,1,0,1,1,1,1
426,I anden halvleg skal vi satse mere på forsvar,6,"halvleg, satse, forsvar",0,0,6.267447135,-0.168714821,6.13,0,15,1,1,1,1,1,1,1,1,0,1,1,1
427,De burde rette deres opmærksomhed mod fortiden,7,"rette, opmærksomhed, fortiden",0,0,10.69540011,1.402547731,6.13,0,16,1,1,1,1,1,0,1,0,1,1,1,1
428,Hun ønskede egentlig at de ville lukke teateret,8,"ønskede, lukke, teateret",0,0,9.116467707,-2.535815231,6.38,0,16,1,1,1,1,1,1,1,1,1,1,1,1
429,Det var bestyrelsen som havde vedtaget projektet,9,"bestyrelsen, vedtaget, projektet",0,0,10.61005117,1.239721106,6.67,0,15,1,1,1,1,1,0,1,1,1,1,1,1
430,Hun kom både til en udstilling og til en premiere,10,"kom, udstilling, premiere",0,0,31.46348076,-2.367590069,5.5,0,16,1,1,1,1,1,0,1,1,1,1,0,1
431,Der er mange økonomer der snakker om pension,1,"økonomer, snakker, pension",0,0,13.86510529,-0.279440619,6.38,0,16,1,1,1,1,1,1,1,0,1,1,1,1
432,Hun var populær fordi hun ville højne niveauet,2,"populær, højne, niveauet",0,0,18.92466533,-0.761541496,5.63,0,8,1,1,1,1,1,1,1,1,1,1,1,1
433,Han understregede netop kvaliteterne i værket,3,"understregede, kvaliteterne, værket",0,0,9.445290901,0.23788392,6.4,0,15,1,1,1,1,1,1,1,1,1,1,1,1
434,De opklarede hvem der havde fastsat datoen,4,"opklarede, fastsat, datoen",0,0,11.70664587,1.3330734,5.27,0,15,1,1,1,1,1,1,1,1,1,1,0,1
435,Det var ret morsomt at de ville fange en ko,5,"morsomt, fange, ko",0,0,12.65158495,-1.314693732,6.13,1,16,1,1,1,1,1,1,1,1,1,1,1,1
436,På laboratoriet udviklede de et nyt protein,6,"laboratoriet, udviklede, protein",0,0,12.3954071,0.47444824,6.63,0,8,1,1,1,1,0,1,1,1,1,1,1,1
437,Vi har netop bestilt en klokke til vores kirke,7,"bestilt, klokke, kirke",0,0,21.95949847,0.006808689,6.44,0,16,1,1,1,1,1,1,1,1,1,1,1,1
438,Vi skønnede at vi godt kunne benytte deres udstyr,8,"skønnede, benytte, udstyr",0,0,17.96435772,-2.711422687,5.87,0,15,1,1,1,1,1,1,1,1,1,1,1,1
439,Det er et hold som kan kvalificere sig til mesterskabet,9,"hold, kvalificere, mesterskabet",0,0,8.811644837,0.288158619,6.53,0,15,1,1,1,1,1,1,1,1,0,1,0,1
440,Arrangøren pegede straks på en enkel løsning,10,"arrangøren, pegede, løsning",0,0,9.012114385,0.288742783,6.13,0,15,1,1,1,1,1,1,1,1,1,1,1,1
441,Der var en professor der grinede af min løsning,1,"professor, grinede, løsning",0,0,12.22598505,-0.81727956,5.75,0,12,1,1,1,1,1,1,1,1,1,1,1,1
442,Han er naiv hvis han vil investere i mit firma,2,"naiv, investere, firma",0,0,16.36991684,1.300821737,5.92,0,12,1,1,1,1,1,1,1,1,1,1,1,1
443,Hendes forældre røg faktisk kun i sommerferien,3,"forældre, røg, sommerferien",0,0,11.78263546,1.724889546,6.14,0,14,1,1,1,1,1,0,1,1,1,1,1,1
444,Hun vil gerne se hvordan man reducerer en sovs,4,"se, reducerer, sovs",0,0,13.69329912,1.306327933,5.75,0,12,1,1,1,1,1,1,1,1,1,1,1,1
445,Det er afgørende at du foretager en forandring,5,"afgørende, foretager, forandring",0,0,15.09779798,1.691255312,5.46,0,13,1,1,1,1,0,1,1,0,0,1,1,1
446,I april skulle vi have registreret vores overskud,6,"april, registreret, overskud",0,0,14.32490035,1.922617459,6.08,1,13,1,1,1,1,1,1,1,1,1,1,1,1
447,Hun ville altid dele sit slik med sine søskende,7,"dele, slik, søskende",0,0,22.78519667,0.135854421,6.75,0,8,1,1,1,1,1,1,1,1,0,1,1,1
448,Jeg vil egentlig helst drikke saft til aftensmaden,8,"drikke, saft, aftensmaden",0,0,4.537897576,5.868043957,6.75,0,8,1,1,1,1,1,1,1,1,1,1,1,1
449,Det er en øvelse som primært styrker benene,9,"øvelse, styrker, benene",0,0,31.79943163,0.377892707,6.63,0,8,1,1,1,1,1,1,1,0,1,1,1,1
450,De fokuserer mest på nyheder og tendenser,10,"fokuserer, nyheder, tendenser",0,0,9.475974699,-0.267252219,6.57,0,14,1,1,1,1,1,1,1,1,1,1,0,1
451,Der er også tandlæger der praktiserer i udlandet,1,"tandlæger, praktiserer, udlandet",0,0,18.92640366,1.944139077,6.63,0,8,1,1,1,1,0,1,1,1,1,1,1,1
452,Hun var grundig når hun kontrollerede sin båd,2,"grundig, kontrollerede, båd",0,0,7.846346333,-1.656109065,5.93,1,14,1,1,1,1,1,1,1,1,1,1,1,1
453,Vores kok har igen opfundet en ny lækker ret,3,"kok, opfundet, ret",0,0,25.88066444,1.157073781,6.75,0,8,1,1,1,1,1,1,1,1,1,1,1,1
454,Han kan aflæse hvem der har ringet i weekenden,4,"aflæse, ringet, weekenden",0,0,16.58765195,1.460244022,5.31,0,13,1,1,1,0,0,1,1,1,1,1,1,1
455,Det var besværligt at vi skulle veje hvert element,5,"besværligt, veje, element",0,0,8.141428434,-1.099616652,6,0,14,1,1,1,1,1,1,1,1,1,1,0,1
456,På en måde har vi altid respekteret mindretallet,6,"måde, respekteret, mindretallet",0,0,12.14168139,-0.304482553,6.17,0,12,1,1,1,1,1,1,1,1,1,1,1,1
457,Forskerne havde advaret os om konsekvenserne,7,"forskerne, advaret, konsekvenserne",0,0,34.00669451,3.182621669,6.67,0,12,1,1,1,1,1,1,1,1,1,1,1,1
458,Han svarede at lovgivningen selvfølgelig gælder,8,"svarede, lovgivningen, gælder",0,0,5.501438437,-0.214613277,6.77,0,13,1,1,1,1,1,1,1,1,1,1,1,1
459,Det var en læge som ejede vores bygning,9,"læge, ejede, bygning",0,0,7.007524336,-1.644123518,6,0,15,1,1,1,1,1,0,1,1,1,1,1,1
460,De ville nedsætte en komite eller et udvalg,10,"nedsætte, komite, udvalg",0,0,10.73671246,-0.669998467,6.62,1,13,1,1,1,1,1,1,1,1,1,1,1,1
461,Der var et orkester der underholdt gymnasieeleverne,1,"orkester, underholdt, gymnasieeleverne",0,0,16.54887787,-1.529466856,5.88,0,8,1,1,1,1,1,1,0,0,0,1,1,1
462,Jeg er altid uheldig når jeg spiller håndbold,2,"uheldig, spiller, håndbold",0,0,20.7065538,-0.810044244,6.47,0,17,1,1,1,1,1,0,1,1,1,1,1,1
463,Formanden ville gerne ud og trække lidt luft,3,"formanden, trække, luft",0,0,10.26596704,1.115422044,5.73,0,15,1,1,1,1,1,1,1,1,1,0,1,0
464,De undersøger hvordan vi kan stoppe udviklingen,4,"undersøger, stoppe, udviklingen",0,0,34.93023012,1.537224103,6.41,0,17,1,1,1,1,1,1,1,1,1,1,0,1
465,Det er utroligt at de vil frasælge deres ejendomme,5,"utroligt, frasælge, ejendomme",0,0,9.121118604,0.818328746,5.47,0,17,1,1,1,1,1,1,1,0,1,1,0,1
466,Om et kvarter skal jeg undervise nogle sygeplejersker,6,"kvarter, undervise, sygeplejersker",0,0,13.65872126,1.513492942,6.63,0,16,1,1,1,1,1,1,1,1,1,1,1,1
467,Mit barnebarn har allerede skaffet mig en billet,7,"barnebarn, skaffet, billet",0,0,16.73735458,-1.143710414,6.71,0,17,1,1,1,1,1,1,1,1,1,1,1,1
468,Vi tænkte at I gerne ville underskrive overenskomsten,8,"tænkte, underskrive, overenskomsten",0,0,9.707595268,0.267351917,5.76,0,17,1,1,1,1,1,0,1,1,1,1,1,1
469,Det er min cykel som holder lige foran museet,9,"cykel, holder, museet",0,0,14.4421807,-1.018790942,6.06,0,17,1,1,1,1,1,1,1,1,1,1,1,1
470,De nyder åbenbart at lytte til vores samtale,10,"nyder, lytte, samtale",0,0,8.375722455,-2.336746818,5.88,0,16,1,1,1,1,1,1,1,1,1,1,1,1
471,Der er en arkitekt der har illustreret en roman,1,"arkitekt, illustreret, roman",0,0,4.5021464,-0.61881617,4.41,0,17,1,1,1,1,0,1,1,1,1,1,1,1
472,Hun var slank fordi hun passede sin træning,2,"slank, passede, træning",0,0,17.22364287,1.47710788,5.88,1,17,1,1,1,1,1,1,1,1,0,1,1,1
473,Originalen var til sidst havnet på et loppemarked,3,"originalen, havnet, loppemarked",0,0,11.62386672,0.524828883,6.63,0,8,1,1,1,1,1,1,1,1,0,1,1,1
474,De planlægger hvor de skal etablere deres fabrik,4,"planlægger, etablere, fabrik",0,0,38.90638538,1.641268873,5.82,0,17,1,1,1,1,1,1,1,1,1,1,1,1
475,Det var væsentligt at de bemærkede fejlene,5,"væsentligt, bemærkede, fejlene",0,0,4.757465242,-2.751391623,5.13,0,16,1,1,1,1,1,1,1,1,1,1,1,1
476,I dag skal han handle med amerikanske aktier,6,"dag, handle, aktier",0,0,13.93571072,1.98095693,5.63,0,16,1,1,1,1,1,1,1,1,0,1,1,1
477,Alle passagererne havde vendt sig mod vinduet,7,"passagererne, vendt, vinduet",0,0,24.58919648,0.350177626,5.94,0,17,1,1,1,1,1,1,1,1,1,1,1,1
478,Vi må konkludere at favoritterne svigtede efter halvlegen,8,"konkludere, svigtede, halvlegen",0,0,7.93643931,-1.053836074,5.69,0,16,1,1,0,1,1,1,1,1,1,1,1,0
479,Det var læserne som skulle udpege en vinder,9,"læserne, udpege, vinder",0,0,8.696278851,-0.939013301,6.13,0,16,1,1,1,1,1,1,1,1,1,1,1,1
480,De skal forhandle med en repræsentant om budgettet,10,"forhandle, repræsentant, budgettet",0,0,7.096164966,2.108941929,5.56,0,16,1,1,1,1,1,1,1,1,0,1,1,1
481,Der var en spiller der pludselig smed sine kort,1,"spiller, smed, kort",0,0,9.033345216,0.953677268,6.07,0,14,0,1,1,1,1,1,1,0,1,1,1,1
482,Han er sund selvom han tit springer over træningen,2,"sund, springer, træningen",0,0,20.75619462,3.751003169,5.71,0,14,1,1,1,1,1,1,0,1,0,1,1,1
483,Hun vil konkurrere med herrerne om mesterskabet,3,"konkurrere, herrerne, mesterskabet",0,0,12.71839269,-1.492985661,6.36,0,14,1,1,1,1,1,1,1,1,1,1,1,1
484,Jeg overvejede hvem der skulle undervise eleverne,4,"overvejede, undervise, eleverne",0,0,7.700599729,-0.090882499,6.8,0,15,1,1,1,1,1,0,1,1,1,1,1,1
485,Det er helt utroligt at vi skal spille i finalen,5,"utroligt, spille, finalen",0,0,15.72867361,1.340777934,6.73,0,15,1,1,1,1,1,1,1,1,0,1,1,1
486,På fredag skal vi hen og afgive vores stemmer,6,"fredag, afgive, stemmer",0,0,9.723422316,1.261601982,6.79,0,14,1,1,1,1,1,1,1,1,1,1,1,1
487,De har afleveret deres anbefalinger til byrådet,7,"afleveret, anbefalinger, byrådet",0,0,6.37710955,-0.675157071,7,0,13,1,1,1,1,1,1,1,1,1,1,1,1
488,Hun undrer sig over at de har nedlagt foreningen,8,"undrer, nedlagt, foreningen",0,0,23.05128777,1.111551764,6.47,0,15,1,1,1,1,1,1,1,1,1,1,1,1
489,Det er min søster som selv udførte projektet,9,"søster, udførte, projektet",0,0,15.26910349,1.837598773,5.93,0,15,1,1,1,1,1,1,1,1,1,1,1,1
490,Han forsøger vist at forbedre sine muligheder,10,"forsøger, forbedre, muligheder",0,0,11.64005366,1.81006354,6.64,0,14,1,1,1,1,1,1,1,1,1,1,1,1
491,Der er et fund der standsede udgravningen,1,"fund, standsede, udgravningen",0,0,6.752213033,-1.523958808,6.13,0,8,1,1,1,1,1,1,1,1,1,1,0,1
492,Hun er afslappet fordi hun har vænnet sig til interviews,2,"afslappet, vænnet, interviews",0,0,12.10294116,1.173628279,6.38,0,8,1,1,1,1,1,1,1,1,0,1,1,1
493,Deres system virkede faktisk bedst under krisen,3,"system, virkede, krisen",0,0,10.70575935,2.6617904,6.63,0,16,0,1,1,1,1,1,1,1,1,1,0,1
494,Vi har hørt hvordan de vil beskytte anlægget,4,"hørt, beskytte, anlægget",0,0,10.6877817,-1.216749699,6.4,0,15,1,1,1,1,1,1,1,1,0,1,1,1
495,Det var oplagt at han ville sætte sig på magten,5,"oplagt, sætte, magten",0,0,8.848264298,1.450473784,6.33,0,15,1,1,1,1,1,1,1,1,1,1,1,1
496,I efteråret vil de producere endnu flere møbler,6,"efteråret, producere, møbler",0,0,11.57813862,0.247729179,6.86,0,14,1,1,1,1,1,0,1,1,1,1,1,1
497,De skal formidle deres pointer til vælgerne,7,"formidle, pointer, vælgerne",0,0,27.70859767,-1.319420296,6,0,14,1,1,1,1,1,1,1,1,1,1,1,1
498,Han insisterer på at vi snart indleder festen,8,"insisterer, indleder, festen",0,0,105.5043835,0.165281964,5.86,0,14,1,1,1,1,1,0,1,1,1,1,1,1
499,Det var en redaktør som kæmpede mod afgifterne,9,"redaktør, kæmpede, afgifterne",0,0,12.5426557,0.474304164,5.33,0,15,1,1,1,1,1,1,1,1,1,1,1,1
500,Han studerede alle malerierne og portrætterne,10,"studerede, malerierne, portrætterne",0,0,18.52377965,-0.938885184,6.8,0,15,1,1,1,1,1,1,1,1,1,1,0,1
501,Der var nogle detaljer der undrede lektoren,1,"detaljer, undrede, lektoren",0,0,11.50162917,0.361901284,6.47,0,17,1,1,1,1,1,1,1,1,1,1,1,1
502,Man skal være stille når man spiser i børnehaven,2,"stille, spiser, børnehaven",0,0,13.31366971,2.609718728,6.76,1,17,1,1,1,1,1,1,1,1,1,1,0,1
503,Mange af vores beboere cykler faktisk hver dag,3,"beboere, cykler, dag",0,0,14.52421381,-1.012737576,6.81,0,16,1,1,1,1,1,1,1,1,1,1,1,1
504,De har opdaget hvordan man kan skærpe sit syn,4,"opdaget, skærpe, syn",0,0,12.15167319,3.03482211,5.82,0,17,1,1,1,1,1,1,1,1,0,1,1,1
505,Det er tvivlsomt at vi kan beholde vores butik,5,"tvivlsomt, beholde, butik",0,0,9.707702283,-0.014645924,4.71,0,17,1,1,1,1,1,1,1,1,1,1,1,1
506,På fredag skal jeg afløse vores næstformand,6,"fredag, afløse, næstformand",0,0,19.14364783,2.304507915,6.75,0,16,1,1,1,1,1,0,1,1,1,1,1,1
507,Vi solgte alle oplysningerne til en virksomhed,7,"solgte, oplysningerne, virksomhed",0,0,8.83175804,1.666051281,6.71,1,17,1,1,0,1,1,1,1,0,1,1,1,1
508,Hun understregede at vi skal smage på prøverne,8,"understregede, smage, prøverne",0,0,9.020805652,0.091589772,6.12,0,17,1,1,1,1,1,1,1,1,1,1,1,1
509,Det er bestyrelsesformanden som indførte det tiltag,9,"bestyrelsesformanden, indførte, tiltag",0,0,9.589787107,0.112036002,5.71,0,17,1,1,1,1,1,1,1,1,1,1,1,1
510,Vi vil gerne integrere teknologien i vores praksis,10,"integrere, teknologien, praksis",0,0,20.21315136,1.159289506,5.25,0,16,1,1,1,1,1,1,1,1,0,1,0,1
511,Der er mange dyr der fascinerer min lillesøster,1,"dyr, fascinerer, lillesøster",0,0,10.57425248,-0.470105061,6.38,0,8,1,1,1,1,1,1,1,1,1,1,1,1
512,Jeg var meget tilfreds da sæsonen sluttede,2,"tilfreds, sæsonen, sluttede",0,0,13.4322964,3.099840116,6.63,0,16,1,1,1,1,1,1,1,1,1,1,1,1
513,Vores chauffør havde ført os hen til kurset,3,"chauffør, ført, kurset",0,0,5.930401037,0.954368939,4.88,0,17,1,1,1,1,1,0,1,1,0,1,1,0
514,De påviste hvem der havde opfundet batteriet,4,"påviste, opfundet, batteriet",0,0,17.10543803,0.069777748,5,0,8,1,1,1,1,1,1,1,1,1,1,1,1
515,Det var dejligt at I ville finansiere begivenheden,5,"dejligt, finansiere, begivenheden",0,0,5.674281223,-1.82318407,6,0,17,1,1,1,1,1,1,1,0,1,1,1,0
516,Inden løbet skal man afholde sig fra at drikke,6,"løbet, afholde, drikke",0,0,8.309285169,-4.662315679,6.13,0,8,1,1,1,1,1,1,1,1,0,1,0,1
517,De ville udlevere en hel milliard til pensionisterne,7,"udlevere, milliard, pensionisterne",0,0,15.69256989,-0.025831224,6.13,0,16,1,1,1,1,1,0,1,1,1,1,1,1
518,De har røbet at de snart vil øge deres støtte,8,"røbet, øge, støtte",0,0,13.72453802,-2.193891195,6.31,0,16,1,1,1,1,1,1,1,1,1,1,1,1
519,Det var din præstation som inspirerede mestrene,9,"præstation, inspirerede, mestrene",0,0,7.454154839,-0.733216696,5.76,0,17,1,1,1,1,1,0,1,1,1,1,1,1
520,Han kender allerede mit navn og min alder,10,"kender, navn, alder",0,0,10.26204894,3.661606634,7,0,16,1,1,1,1,1,1,1,1,1,1,1,1
521,Der var nogle journalister der spredte oplysningerne,1,"journalister, spredte, oplysningerne",0,0,10.99328936,0.420952226,6.38,0,8,1,1,1,1,1,0,1,0,1,1,1,1
522,Hun er usikker fordi hun har glemt sin tale,2,"usikker, glemt, tale",0,0,9.677472195,1.289705891,5.53,0,15,1,1,1,1,1,0,1,1,1,1,1,1
523,Min hustru er lige kørt ind til vores forretning,3,"hustru, kørt, forretning",0,0,45.12169663,-0.205985053,5.6,0,15,1,1,1,1,1,1,1,1,1,1,0,1
